thread_id,forum,title,content,views,comments,url,username,user_id,user_url,date
73388,drugsforum,4F-MPH of 3 cmc ?, Ik ga voor het eerst bestellen. Heb ervaring met verschillende illegale drugs.   Nu zoek ik een vervanger voor mdma en miauw miauw (vgm is dit 4mmc).  Is 4F-MPH vervanger voor mdma  En de 3cmc voor de poes ?   ,996,28,https://drugsforum.nl/threads/4f-mph-of-3-cmc.73388/,indewarre.nl,157185,https://drugsforum.nl/members/indewarre-nl.157185/,2022-11-30
73381,drugsforum,3mmc magnetron," Hoi hoi,  Lang niets gepost. 3mmc is heel plakkerig en nattig na een keertje gebruik en nieuw zakje is ook al een beetje plakkerig. Kan dit in de magnetron om te drogen? Of zal ik t op een bordje op de verwarming zetten   ",451,9,https://drugsforum.nl/threads/3mmc-magnetron.73381/,Krullen,128087,https://drugsforum.nl/members/krullen.128087/,2022-11-30
73363,drugsforum,4F-MPH voor het eerst gebruiken," Hi, binnenkort ben ik van plan 4F-MPH te gebruiken om te studeren en te werken aan mijn deadlines. Een pallet bevat 30mg 4F-MPH. Ik heb me er aardig over ingelezen, ik weet wat de bijwerkingen zijn maar heb toch nog een aantal vragen. Ik vraag mij bijvoorbeeld af hoe vaak ik dit kan gebruiken, zo dat ik niet afhankelijk wordt van het spul. Daarnaast vind ik het toch lastig om uit te zoeken wat de beste dosering is voor wat ik wil bereiken. Ik lees namelijk verhalen van mensen die 8mg in totaal nemen en anderen die 25mg gebruiken voor de studie. Ik zat zelf te denken om te starten met een kwart of 3/8e. Dit is dus 7,5-11,25mg. Mocht dit niet werken, doe ik een kwart er bij.   Ik heb gelezen dat deze variant sterker is dan normale Methylfenidaat en heb zelf nooit Methylfenidaat genomen. Ik wil het daarom wel voorzichtig aan doen. Straks neem ik te veel en zit stuiterend op mijn stoel zit en wil dansen omdat ik nergens mijn energie kwijt kan.   Ik vraag daarbij ook om wat bevestiging, heb ik mijzelf juist ingelezen of heb ik nog iets over het hoofd gezien? En is dit de juiste aanpak, of is het beter om het anders aan te pakken? Een andere startdosering, een andere bijneem dosering oid.   ",520,4,https://drugsforum.nl/threads/4f-mph-voor-het-eerst-gebruiken.73363/,julianschipper,156673,https://drugsforum.nl/members/julianschipper.156673/,2022-11-27
73358,drugsforum,Trenbolone," Hoi lieve lezers,   Ik ben gisteren begonnen aan een kuurtje tren. Eigenlijk ben ik op zoek naar ervaringen of tips.  De dag na injectie; Ik voelde me wel fit en ook wat sterker dan normaal. (Ik werk in de horeca en de dienbladen waren minder zwaar als eerst) Ik ben wel wat aangekomen. Ook voel ik me strakker in m'n vel. Ik ben super benieuwd hoe deze kuur uit gaat pakken.  Liefs, Rodina   ",328,2,https://drugsforum.nl/threads/trenbolone.73358/,Magicalwoman,151580,https://drugsforum.nl/members/magicalwoman.151580/,2022-11-27
73351,drugsforum,2F DCK dosiis, wie kan me helpen?  Veel gelezen en gezocht maar wie kan me helpen wat beste dosis 2F DCK is en om de hoeveel tijd bijnemen?  Heb het spul liggen en wou het vanavond proberen....ps ben gewoon normaal gebouwd en 90kg  mvg wapboy   ,258,6,https://drugsforum.nl/threads/2f-dck-dosiis.73351/,wapboy,136624,https://drugsforum.nl/members/wapboy.136624/,2022-11-25
73348,drugsforum,"6-APB, vraag over dosering van succinate variant"," Hoi iedereen!  Aanstaande zaterdag ben ik van plan om 6-APB te gebruiken in het bijzijn van vrienden die MDMA zullen doen. Ik heb veel gelezen over de stof via Erowid en Psychonaut, en heb denk ik een redelijk goed beeld van de effecten van deze substantie. Het doseren van deze drug blijkt echter best lastig te zijn heb ik vernomen, aangezien de puurheid per batch voor de succinate variant enorm lijkt te variëren. Ik heb een halve gram aan poeder en een tablet van 130mg (beide succinate) besteld. Aangezien ik al veel ervaring heb met serotogene stimulanten lijkt 150mg mij een redelijke dosis (69kg, 1,75). Echter lijkt het erop, als ik het goed begrijp, dat ik de dosering hiervan enigzins zal moeten bijstellen afhankelijk van de puurheid van de batches. Ik vroeg mij dus af wat jullie ervaringen zijn met succinate doseringen. Alle input omtrent dosering is welkom in ieder geval, en daarvoor bedank ik jullie alvast    ",1000,11,https://drugsforum.nl/threads/6-apb-vraag-over-dosering-van-succinate-variant.73348/,BvK,157142,https://drugsforum.nl/members/bvk.157142/,2022-11-24
73344,drugsforum,5-apb in mijn 6-apb?," Beste DFers,  Ik heb mijn 6-apb laten testen afgelopen week, en hier zit dus een beetje 5-apb in. Nu vroeg ik mij af of andere mensen dit eerder gezien hebben en in hoeverre dit uit maakt. Mijn laatste keer XTC is 11 weken geleden, en ik ben van plan volgende week een 120mg dosis van deze 6apb te nemen.  Ik ben benieuwd naar jullie ervaringen!  mvg, Glorytripper   ",987,16,https://drugsforum.nl/threads/5-apb-in-mijn-6-apb.73344/,GloryTripper,156772,https://drugsforum.nl/members/glorytripper.156772/,2022-11-24
73339,drugsforum,2 c-c vragen, prettige dag  ik heb 2-c c in gedesintegreerde pilvorm. Helaas heb ik hem niet in een afgesloten zak bewaard.  Het werd bewaard in een donkere kast en op kamertemperatuur. maar het kwam in contact met de lucht. Die staat er al 3 weken.  zou het corrupt kunnen zijn? Ik denk dat er niets is gebeurd. Ik wilde het je nog steeds vragen  Met dank   ,1000,24,https://drugsforum.nl/threads/2-c-c-vragen.73339/,hiimacid,155476,https://drugsforum.nl/members/hiimacid.155476/,2022-11-23
73336,drugsforum,Foute levering, Van een bekende vendor kreeg ipv mijn vertrouwde bestelling (Bromazolam voor af en toe en 3CMC voor in het weekend) 3-FA geleverd. Na snelle communicatie krijg ik wss deze week het juiste toegestuurd.  Maar wat moet ik met die 3-FA? Wegpleuren? Proberen? Ik weet het niet.   ,415,3,https://drugsforum.nl/threads/foute-levering.73336/,FishtailLemon,154672,https://drugsforum.nl/members/fishtaillemon.154672/,2022-11-23
73325,drugsforum,O-pce," Hoi, Ik heb zojuist o-pce binnen gekregen nu heb ik een paar vraagjes over wat ik kan verwachten.  1. Hoelang werkt het en na hoelang kan ik weer normaal doen en gewoon lopen en praten  2. Wat zijn de effecten   3. Hoeveel moet ik nemen  Vriendelijker groetjes  snuifbeertje   ",714,6,https://drugsforum.nl/threads/o-pce.73325/,Mark247,156260,https://drugsforum.nl/members/mark247.156260/,2022-11-22
73324,drugsforum,"6APB, een groot mysterie.. HELP!!"," Dag lieve forumleden,  Gezien ik al geruime tijd mee lees maar zelf enorm nieuw ben zal ik het kort en bondig proberen te houden. Ik weet overigens ook niet of ik dit op de juiste plek plaats maar hier komt het:  Ik was laatst bij de smartshop bij mij in de buurt, na een leuke ervaring met truffels was ik nieuwsgierig naar wat er nog meer te halen viel. Na een paar korte vragen aan de medewerker wát wát is, en een leuke uitleg over bepaalde middelen, kwam het gesprek op stimulanten.  Uit het niks trekt hij een laatje open verborgen in een soort oude klok en laat mij een handje vol met buisjes zien. Hij vertelde dat dit het sterkste was wat er in de smartshop te halen viel. 6APB en 4FA door elkaar gemixt in vloeibare vorm vertelde hij mij nadat ik er wat op doorvroeg.  Gezien ik een flinke geschiedenis heb met een heleboel drugs wist ik natuurlijk gelijk dat dit RC’s zijn en alles behalve producten van moeder natuur. Ik was ontzettend benieuwd maar wist dondersgoed dat ik nooit zeker kon weten dat wat hij mij vertelde ook echt zo was.  Lang verhaal kort, ik heb zo’n buisje meegenomen en samen met mijn vriendin maar op de gok door wat drinken heen gedaan en genuttigd. Ik zal de details besparen anders word dit een tripreport maar ik kan je zeggen: het was super 😻  Na deze bewuste avond heb ik internet afgespeurd en proberen terug te vinden wat ik nou precies gebruikt heb. Inmiddels weet ik bijna zeker dat het hoofdzakelijk 6APB moet zijn geweest. Het ding is: ik wil dit super graag nog eens doen, wél met een iets hogere dosering, maar NIET uit een schimmige zaak van waar ik dus geen idee heb hoe en wat.. (de buisjes zijn er overigens ook niet meer te koop)  Ik heb een vendor waar ik in het verleden wel is pellets Clonazolam heb besteld maar met dingen als 6APB weet ik mij gewoon geen raad, ik lees ook over verschillende soorten bereidingen van 6APB, ik lees over oraal of nassaal, ik lees over doseringen die variëren van 100/130 tot 200+ mg, kortom: ik weet niet waar ik moet beginnen!  Er van uitgaande dat ik een gram poeder bestel wat ik op deze desbetreffende website zie, kan iemand mij een ruwe indicatie geven van wat een normale dosering is? Wat het verschil is tussen “sulccinate” (als ik dat goed heb) en nog iets anders..? En wat het juiste tijdsbestek is om bij te doseren indien nodig?  Laat ik vooropstellen dat ik slechts om meningen, ervaringen, en mensen met kennis vraag. Ik zou nooit iets blind aannemen en volledig vertrouwen op iemand zijn of haar woord. Ik heb genoeg ervaring met stimulanten maar hulp word erg gewaardeerd!  Ik kijk uit naar jullie berichten ❤️   ",1000,31,https://drugsforum.nl/threads/6apb-een-groot-mysterie-help.73324/,BroodjeSouflaki,155137,https://drugsforum.nl/members/broodjesouflaki.155137/,2022-11-21
73315,drugsforum,Houdbaarheid 4-FA poeder," Hallo iedereen,  Na vroeger groot fan te zijn geweest van 4-FA capsules (onuitputtelijke scherpte, energie en blijdschap zonder de nare comedown als bij MDMA) ben ik in tijden van verbod overgestapt op speed.  Na veel twijfels voldeed dit prima, de rush en euforie is minder maar voor energie (het gene wat ik zoek tijdens het feesten) is het genoeg. Na het verbod is het vinden van echte 4-FA (geen 4-FMA dus) erg lastig geworden. Jaren geleden net voor het verbod kwam heb ik nog een kleine bestelling kunnen plaatsen en heb hier een klein beetje van bewaard voor als ik het weer een x wil gebruiken om de oude tijden te herleven. De kleur van het poeder is echter veranderd. Vroeger was het wit en had het een hele lichte grijze gloed, nu jaren later is het donkerder geworden en is het iets korreliger. Ik heb het altijd in een gripzakjes op een droge en donkere plek bewaard.  Weet iemand hier met scheikundige kennis of  veel ervaring met 4-FA of dit nog te gebruiken is en of het nog even potent is als toen ik het heb gekocht?  Dankjewel!   ",185,0,https://drugsforum.nl/threads/houdbaarheid-4-fa-poeder.73315/,Nakketikker,157108,https://drugsforum.nl/members/nakketikker.157108/,2022-11-19
73312,drugsforum,"MAL Methallylescaline: mening, ervaringen, tips?"," Hoi allemaal,  Binnenkort wil ik met een maatje een keer MAL gaan proberen. Nu kan ik er op internet niet super veel over vinden, al heb ik wel wat reports gelezen oa hier op het forum. We hebben beide veel tripervaring met tientallen trips: truffels, LSD, RC tryptamines en een enkele keer een 2-C variant.   Ik was wel benieuwd naar jullie ervaringen met dit middel! Waar kun je het het beste mee vergelijken, wat kan ik verwachten? Wat is een fijne omgeving om het te doen en wil je er wel of niet actief op bezig zijn? Op LSD bijvoorbeeld gaan we altijd een paar kilometer wandelen, liefst overdag, omdat we niet stil kunnen zitten. Tryptamines doen we juist het liefst in de avond in een leuk aangeklede ruimte.  Op LSD doen we het meestal rond de 150ug omdat we een intense headspace niet zo prettig vinden, maar wel van visuals houden natuurlijk. Voor tryptamines ben ik vrij gevoelig (10mg 4-HO-MET is voor mij al een volwaardige trip). Wat zou een goede startdosis zijn? Ik zat te denken aan 35mg ongeveer. We hebben gelezen dat er misselijkheid bij kan komen kijken, dus we halen sowieso gember in huis.  Ik ben erg benieuwd    ",174,0,https://drugsforum.nl/threads/mal-methallylescaline-mening-ervaringen-tips.73312/,Boyman,152513,https://drugsforum.nl/members/boyman.152513/,2022-11-19
73309,drugsforum,3MMC oraal doseren," Hallo allemaal,  Morgen staat er een hardstyle feest op de planning en ben van plan een keertje 3mmc te gebruiken. Nu heb ik het een jaar geleden een keer gesnoven op een huisfeest, dit was me goed bevallen. Alleen de bloedneus de dagen daarna was niet zo prettig.  Om dit te voorkomen wil ik het morgen dus gaan slikken. Alleen het probleem is dat ik niks heb om het af te wegen. Hoe gaan jullie hiermee om?  Ik weeg 85kg en heb genoeg ervaring met andere drugs. Hoor graag jullie tips!  Groetjes,  De 2C-Baas   ",619,15,https://drugsforum.nl/threads/3mmc-oraal-doseren.73309/,2C-Baasje,154352,https://drugsforum.nl/members/2c-baasje.154352/,2022-11-18
73303,drugsforum,Slapen na 3-MMC?," Ik heb morgen avond een feestje waar ik voor het eerst 3-MMC wil gebruiken. Het feest duurt tot 06:00. Al zal ik waarschijnlijk wel wat eerder naar huis gaan. Ik hoop om 06:00 op bed te liggen want het is namelijk zo dat ik de volgende ochtend 8:30 op werk moet zijn.  Beide ga ik niet afzeggen. Maar ik moet er wel even rekening mee houden zeg maar qua dosering en tijd van inname. Het liefst wil ik nog 1 a 1,5 uur slaap pakken voor ik naar werk ga. Als dat niet lukt ook geen ramp als ik maar niet met een drugskop op werk kom met gigantische doppen. Dat zou echt fucked up zijn.   Psychonaut wiki zegt bij oraal gebruik 4-6 uur. Dus als ik om 22:45 220mg 3-MMC oraal inneem zou het goed moeten komen? Of toch beter snuiven vanwege de kortere werking? Kan eventueel ook half half doen.   ",1000,36,https://drugsforum.nl/threads/slapen-na-3-mmc.73303/,TheRealKoekert,155945,https://drugsforum.nl/members/therealkoekert.155945/,2022-11-17
73285,drugsforum,O-DSMT manier gebruik," Hoi allen,  Ik heb hier wat O-DSMT liggen slikken geeft niet het gewenste effect, ik vroeg me af of het ook te snuiven of te roken is.  Niet of het kan maar of het werkt en mensen hier ervaringen mee hebben. Graag normale reacties    ",324,6,https://drugsforum.nl/threads/o-dsmt-manier-gebruik.73285/,Drugskikker22,150293,https://drugsforum.nl/members/drugskikker22.150293/,2022-11-15
73267,drugsforum,3-FA en heel fijne beleving," 04u40: 3FA 125mg oraal  Terwijl ik dit typ of ca gepost zal zijn, zitk ca 4u35 bij vriendin.  En juaa zne de 3fa zitr al van 6u echt lekker in (dikke half5 125mg) 😁 En zo ook in über energy modus, nachtelijk, allé ochtend bezoekje gaan brengen bij vriendin, ca 10-15min stappen, was zo vóór 6u, dus de piek moest nog komen, ma kging al in Duracell modus.   Dus ook sociale mood, focus, de zin n nood, ma weinig v dingen aantrekken...of noem het hyper n niet opgeef mood, keb da maske letterlijk non stop zot gebeld, phone, ging over mr constant voicemail, tegelijk deurbel nr de pleuris geklopt😆  En net dak et wou opgeven en enkele meters richting thuis verplaatste, belt ze mij, mé slaapstemmeke n vré ongerust op. Ik blij as klein kind, n ma tetteren n dak nog vlakbij zen, die merkte natuurlijk dak iets had gepakt, dus zo goe da zis en da ze alleen al weet dak onder invloed ben, moestkt geen 2x vragen, ja ja kom mr binnen, klaat u in die toestand ni alleen terug gaan.   Ik in strakke energy modus, dansend de lift in, gaak binnen en echt toenk da slaapkopke zag en ik über overweldigend n hyper 2.0 en best geil ook, want we knuffel gaven, wouk ni lossen en knuffelde wa steviger door en kheb energie vo 2 en plakkend tegen elkaar, de zetel ingeploft, zij half op mij, ik ben ook kei klef, geil en ocharme vr da maske, midden uit hare vaste slaap gebeld, super loom, krijgt ge dees ineens in aa appartement.   Ik liet haar in de zetel en ik kan ni stilzitten, ondertussen muziek opgezet, ni te luid, ma dansend, zie ik alle hoekjes vd ruimte, benk kei actief, pak vanalles vast, op dit moment, nog geen fijn gezelschap vr haar (vertelde ze later).  Het té hyper strakke, verloor meer van z'n pluimen. Had ik fijn en speels contact met de 2 woefkes, waark anders eerder uit buurt blijf.   Alles is meer en meer toppie n kzoek al snel terug gezelschap v vriendin op, ma die was vo mij te gewoontjes n serieus en begon dan te vragen ofk çva was n wak gepakt heb, kweet da zij het fijne wilt weten, voor geval dat ik slecht zou gaan fzo...en kreageer helder n gefocust op alles.   Zitten knusjes tegen elkaar, omdat zij het eerder fris é, mr ik juist warm, dus zij goe ingeduffeld, ik in t-shirt en het werd, allé is nu nog omgeslagen in heerlijk veel praten met elkaar, ik zeer open en zij ging daar ook in mee, ben ook gewoon pak minder in die lijfelijke hyper, da's relatief, ik kan moeilijk stilzitten en wil knuffelen en haar opeten, mr allemaal redelijk braaafjes n meer speels en zij geniet ook v de affectie n ze laat me ook doen en zelf aait ze me en voelen ons beide über comfy en ik zit in über praat en ook luistermodus en we hebben het super gezellig samen, open gesprekken zonder gêne.   Ze dan ook zé, amai eerst dachtk ohnee, wa moek nu, hij een Duracell konijn vs ik die letterlijk uit slaap is gerukt en in te vermoeide periode zit n bleef, waarbij ze vreesde dat ze door mijn strakke hyper gedrag, geagiteerd en geïrriteerd zou geraken.  Maar door mijn reeds minder hyper energy, die de ruimte met happy en no stress vibe vulde, waarbij alles goe is vr mij n eigenlijk über easy is, ervaaade zij, dit ook als een über aangenaam onderonsje.   Alle harde, scherpe kantjes, de overdrive van emoties, de mr proper met tikkie smetvrees, zwart-wit mindset, de veeleisende, die vaak sarcasme tot cynisme uitstraalt en hard kan zijn met woorden, zijn vr groot deel afwezig door de 3fa, ik zeker eerste fase, sowieso een weinig controleerbare strakke focus energy ervaar en dit deels sterk kan beïnvloed worden door setting.  In huidig geval, was ik eerst strak hyper n fullll energy, maar na verdwijnen vd über strakke energy, ben ik echt top gezelschap gebleken vr mn vriendin en zorgde ik vr een ongedwongen, good feeling vibe, met wederzijdse affectie en veel gesprekken, zowel luchtig als diepe gesprekken, maar waar we beide, anders snel kunnen ontsporen, in een ongecontroleerbare emotie-bommeked, ging dit nu zoveel beter, wat vr een gemoedelijke en gezapige sfeer n vibe zorgde tussen ons beide.   Zo extreem verschillend, ivm onze ontmoetingen, wanneer ik zonder iets of met alcohol (geld ook vr haar) op, toch rond de 60-70% in soms ferme drama en extreme emoties gewikkeld waren.   ",1000,19,https://drugsforum.nl/threads/3-fa-en-heel-fijne-beleving.73267/,Nihilist88,152494,https://drugsforum.nl/members/nihilist88.152494/,2022-11-11
73264,drugsforum,Xtc pil met 4cmc, Ik heb een xtc pil laten testen. Zit 177mg mdma in en een kleine hoeveelheid 4cmc. Dit heb ik nog niet eerder gezien in een xtc pil. Hebben jullie ervaringen hiermee? Kan het kwaad? Is het leuk? Of af te raden te gebruiken?  de pil is niet veel zwaarder dan de mdma dus het is sowieso heel weinig wat er in zit. Graag jullie advies 😀   ,780,6,https://drugsforum.nl/threads/xtc-pil-met-4cmc.73264/,flowx,156465,https://drugsforum.nl/members/flowx.156465/,2022-11-10
73263,drugsforum,Eerste keer pyrazolam 3mg," Hallo allemaal, Ik heb al enige tijd last van mijn rug/spieren. Kreeg door op internet te zoeken interesse in Benzo’s. Kwam uit bij Pyrazolam. Iets wat rustgevend en spierontspannend moet werken. Gisteren om 20.45 uur 3mg ingenomen. Het moment dat het begon te werken weet ik niet precies, viel vrij snel als een blok in slaap.  nu de volgende dag 12.56 uur ben ik nog steeds niet helder. Voel me vreselijk duf en moe, kan amper functioneren. Iets wat niet in de recensies stond van dit middel. Zijn er meer mensen die dit hebben ervaren? En wat kan ik eraan doen om weer snel normaal te kunnen functioneren? Ik had begrepen dat deze Benzo niet zo lang zou doorwerken maar het tegendeel (bij mij) is dus waar…   ",972,7,https://drugsforum.nl/threads/eerste-keer-pyrazolam-3mg.73263/,Rtm,157027,https://drugsforum.nl/members/rtm.157027/,2022-11-10
73261,drugsforum,3mmc dosering," Goedemorgen!  Ik wil binnenkort 3mmc gaan slikken. Wat zou een goede dosering zijn? Ben zelf ongeveer 70 kilo en en heb 3mmc nog nooit eerder gedaan, wel 4mmc. Zat zelf te denken aan 125mg om mee te beginnen en dan nog een bommetje van 80mg meenemen om bij te nemen. Is dit handig? Of kan ik beter een hoge startdosis hebben en niet bijnemen?  heb gehoord dat je van snuiven erg veel cravings krijgt dus wil het eigelijk ook niet meenemen, alleen 1/2 bommetjes mee.   ",693,5,https://drugsforum.nl/threads/3mmc-dosering.73261/,qwertysafgo,155065,https://drugsforum.nl/members/qwertysafgo.155065/,2022-11-10
73255,drugsforum,Weet niet wat het beste te nemen," Zaterdag gaan mijn man naar een feestje. Heeeel lang geleden hebben we tijdens het stappen xtc gebruikt. Dat gevoel wat we toen hadden was heel fijn. Nu wil ik vanavond op internet iets bestellen wat een beetje daarbij in de buurt komt. Aangezien we niemand kennen die xtc verkoopt wil ik het bestellen als RC. Zie zooooo veel verschillende soorten dat ik niet weet wat te kiezen. We willen ons “ vrij “ voelen, gemakkelijk kletsen met vreemden, meer zin in sex krijgen en meer energie. Welke denken jullie dat ik het beste kan bestellen ?   ",435,7,https://drugsforum.nl/threads/weet-niet-wat-het-beste-te-nemen.73255/,Saar1978,157011,https://drugsforum.nl/members/saar1978.157011/,2022-11-09
73248,drugsforum,Hees/zwaardere stem na 3MMC slikken?," Hallo allemaal, eerste post hier dus vergeef me als er iets niet aan klopt.  Regelmatig (om de 3-4 weken) slik ik in het weekend bommetjes (size 2 capsules ongeveer 1/3 vol) met 3MMC. De rest van de groep snuift, maar mijn neus is vanbinnen genetisch een beetje misvormd en heb wat operaties gehad waardoor dat erg pijnlijk is voor mij.  Nu kan ik me er iets bij voorstellen dat snuiven iets met je stem doet, maar ik heb het nu al 2 keer gehad dat ik in de loop van de avond een steeds zwaardere stem krijg terwijl ik dus niks snuif. Krijg ook voice cracks/stem die soms overslaat (wat de rest overigens wel erg grappig vindt). Is na een dag of 2 weer normaal. Ging allebei de keren ook gemoeid met wat lichte keelpijn die 2 dagen erna.  Iemand enige ervaring hiermee of weet hoe dit uberhaupt kan? Ik stop het in echt afgesloten capsules die pas onder invloed van maagzuur in mijn maag opengaan, dus er zou nog geen korrel in mijn keel terecht moeten kunnen komen.   ",983,21,https://drugsforum.nl/threads/hees-zwaardere-stem-na-3mmc-slikken.73248/,Nassauwe,156994,https://drugsforum.nl/members/nassauwe.156994/,2022-11-07
