thread_id,forum,title,content,views,comments,url,username,user_id,user_url,date
72631,drugsforum,2-fa is geweldig," Ik ben een nieuwe speler en ook vooral voorzichtig. Helaas in de familie wat gevallen die mensen die onvoorzichtig met sommige snoepjes zijn omgegaan en hierdoor psychoses hebben opgewekt ect.  Nu ben ik met een goede week slapen, positief nieuws en sporten van mezelf euforisch. Maar als ik niet goed slaap, dan ben ik absoluut niet praatgraag, soms wat verlegen.  Soms heb ik net een beetje nodig om wat meer te praten. Maar met een fijne borrel en gemoedstoestand ook praatgraag.  Dat beetje extra vond ik met xtc te heftig. MDMA ging wel, maar een drankje erbij maakte dat het soms te euforisch werd. diepe verhalen met iedereen en dat is niet mijn persoonlijkheid. Beetje kletsen prima, maar hoef echt niet over mijn overleden hond van 12 jaar te praten of politiek. Maar mdma, xtc en een fijne sterke pijnstiller vanwege mijn rugklachten maakte dat ik oprecht rare dingen deed en zelfs een avond een black-out…had     En toen was ik het zat, er moet vast iets op de markt zijn wat soft valt en waarbij je 3 drankjes mag drinken.  Na onderzoek kwam ik uit bij 2-fa  wauw, normale pupillen. Bij de eerste 2 pillen prima binnen uur. De 3de was too much en niet nodig. als in dat ik echt te veel begon (60% minder dan met xtc)  te praten en niet gekke kaak bewegingen, maar eerder moeten kauwen en ect. Maar dan 70% minder dan met xtc. Zie het als, een ordinaire wijf wat kauwgom kauwt,  Ik had prima een pilsje moeten doen om het effect iets te vergroten. In plaats van die 3de pill. Of die 3de 1,5 uur later.  Muziek klinkt fijner  - Informatie opzoeken op je mobiel is ook super chill  - De muziek was niet echt om te dansen, maar stond op wel een beetje heen en weer te bewegen.  - Meer energie, maar op een manier dat dat middag net is begonnen en je toewerkt tot de avond.    Thuis aangekomen helaas de fout gemaakt om te denken dat ik thuis verder spacen leuk zou vinden. Helaas was de 2-fa op. En had ik nog 3-FPM bestel. Eigenlijk als back up wanneer ik moe was en ik opeens uit wou gaan. Maar niet voor nu.   Eigenlijk met tegenzin omdat mijn partner dit altijd al wou doen en ik nu dacht, ik wil niet maar f it. Wat een drama na inname had ik al spijt en ging ik slapen. En werd wakker en ging slapen en werd wakker en ging slapen en ect. Wat een hell! Ik gooi ze weg, schrik ervan sta ik 7 uur lang niet kon slapen. Prima voor een rave, eentje maar ondanks dat vond ik het gevoel bij mijn ogen en dorstig niet fijn. Met 2-fa had ik amper dorst of honger   Maar maandag voelde ik mij top, dinsdag ook en woensdag ook! Alleen donderdag had ik het idee vermoeider te zijn, maar geen negatieve gedachtes. Of iets wat in de buurt komt van de dinsdag dip.  Dus ben je een lichtgewicht, wil je net een beetje. Iets wat niemand merkt en heb je geduld met doseren dan is dit je ding. 2-fa! En ga gewoon voor de 2 pillen verspreid over een festival avond 5 tot 12 en hou het bij 5 drankjes.   ",1000,3,https://drugsforum.nl/threads/2-fa-is-geweldig.72631/,Dpc,156240,https://drugsforum.nl/members/dpc.156240/,2022-08-02
72621,drugsforum,DMT," Toenstraks 5-MeO-DMT gedaan. 10-12mg was de dosis. (Weet het niet meer precies) Had eerst 15mg op mijn weegschaal liggen maar dat vond ik iets te veel van het goede. Ben zelf redelijk ervaren met trippen. Maar DMT is toch altijd even wennen omdat het next level is. De vorige keer N,N-DMT was echt al jaren geleden.    De eerste minuut had ik even een soort korte paniek aanval. Misschien hielp het ook niet mee dat ik het “gesandwhiched” gerookt heb met wiet. Dat de eerste unbewuste reactie van je brein is: Oh lekker dit ken ik. En niet veel later oh fuck wat is dit. Maar waarschijnlijk was het vooral gewoon de DMT waar ik even aan moest wennen.  De meeste tripmiddelen komen langzaam opzetten en zo kun je er ook langzaam aan wennen. DMT roken/vapen propt dit process van misschien wel een uur in iets van 1 minuut. Maargoed ik heb mijzelf ook weer vrij snel weten te kalmeren met mijn kat en daarna genoten van muziek en visuals. Visueel leek het meer op een hogere dosis 2C-B dan N,N-DMT. Dus alles begon hevig te golven. Van de 15-20 minuten die ik echt getript heb (schatting) was de eerste minuut misschien wat onprettig. En daar wen je misschien ook nooit aan? Het is denk ik vrij lastig om met totale rust/ontspanning een DMT trip in te gaan?   Verder kan ik het slechts vergelijken met die ene keer dat ik N,N-DMT deed en een breakthrough had. Toen was ik echt in een andere wereld. Dat is niet mogelijk met 5-MeO-DMT denk ik? Aangezien het allemaal veel minder visueel is. Eigenlijk zou ik N,N-DMT ook nog eens moeten proberen op een iets lichtere dosis.   ",2000,14,https://drugsforum.nl/threads/dmt.72621/,TheRealKoekert,155945,https://drugsforum.nl/members/therealkoekert.155945/,2022-07-31
72620,drugsforum,METHOXPROPAMINE, Holly shit  K hole. Geen informatie te vinden. Oppassen kerels of meiden.  Super ketamine Goed afwegen op mg.   ,632,12,https://drugsforum.nl/threads/methoxpropamine.72620/,Eburoon zuiden van kempen,156088,https://drugsforum.nl/members/eburoon-zuiden-van-kempen.156088/,2022-07-31
72618,drugsforum,3mmc verschil pellets en kristallen. Beiden oraal," Wij hebben voor de ban altijd pellets gebruikt. 200mg pellets gebruikten we. Nu hebben we kristallen en deze gedoseerd in 200mg capsules. Het effect is nog niet half van wat we gewend zijn.  leverancier geeft aan dat het zeker wel 3mmc is, en niet 3cmc. Ik betwijfel dat. Is er enige reden waarom pellets meer effect hebben dan losse kristallen of heeft ie ons gewoon echt 3cmc of 2mmc verkocht?  ik ben me ervan bewust dat alleen met testen er zekerheid is. De pellets zijn op en kunnen niet meer getest worden 🤣 geen idee of 3mmc te testen is bij de centra.   ",854,5,https://drugsforum.nl/threads/3mmc-verschil-pellets-en-kristallen-beiden-oraal.72618/,LadyLike,151979,https://drugsforum.nl/members/ladylike.151979/,2022-07-30
72595,drugsforum,5-MeO-DMT roken of vapen?," Vandaag mijn RCs binnen gekregen. En nieuwsgierig dat ik was vandaag al een hele lichte dosis 5-MeO-DMT geprobeerd. (Net iets meer dan de threshold dose) Aangezien ik te lui en ongeduldig ben om het te laten testen was dit de eerste test. Volgende keer een normale dosis van 10mg. (Ik lees btw dat je na 2 uur alweer 5-MeO-DMT kan doen?)  Maar ik heb het nu gerookt in een wietpijpje met de sandwhich methode. Zoals ik ooit ook ""normale"" DMT gerookt heb. Maar er zijn betere manieren heb ik vernomen. Zo een methpijp schijnt goed te werken icm een butaan aansteker. Hebben jullie daar ervaring mee? Is het wat? Ga dit weekend naar amsterdam dus misschien maar een kopen. Er bestaan ook vaporizers die er geschikt voor zijn. Maar welke? Heb zelf een Arizer Go en Arizer v tower. Maar die zullen wel niet geschikt zijn ervoor gok ik. Bovendien gaat waarschijnlijk heel het apparaat stinken naar die DMT. Welke vape gebruiken jullie ervoor?   ",2000,17,https://drugsforum.nl/threads/5-meo-dmt-roken-of-vapen.72595/,TheRealKoekert,155945,https://drugsforum.nl/members/therealkoekert.155945/,2022-07-27
72584,drugsforum,RC advies gezocht," Binnenkort ga ik een heel weekend naar een festival (zaterdag en zondag). Op zaterdag ga ik MDMA gebruiken (kater heb ik nooit). Op zondag zou ik nuchter kunnen blijven, maar ik vind het bij gebrek aan een kater ook een uitgelezen kans om eens een legaal stofje te proberen.  Welke RC adviseren jullie daags na MDMA? Ik ben op zoek naar de energie en uithoudingsvermogen van MDMA (het liefst ook de euforie, maar ik neem aan dat dit niet kan zonder serotonine te slurpen?). Een soort speed dan denk ik, maar hoef niet mega strak te staan. Sowieso ben ik praktisch gezien niet zo van speed. Snuif niet graag en klooien met bommetjes geen zin in. Liefst gewoon een pellet die ik naar binnen kan mikken.  Heb al wat onderzoek gedaan, maar loop een beetje vast. Komt bijv. 3-FA in de buurt?  Ik hoor jullie ervaringen/tips graag, bedankt!   ",480,1,https://drugsforum.nl/threads/rc-advies-gezocht.72584/,Wollukker,155386,https://drugsforum.nl/members/wollukker.155386/,2022-07-26
72565,drugsforum,Research Chemicals sterven uit?," Ik weet niet zeker of ik het goed zie. Maar als straks alle wenselijke verbindingen van moleculen verboden zijn is het uiteindelijk grotendeels klaar met research chemicals? Want volgens mij (correct me if im wrong) worden die stoffen meestal niet in nederland of in europa geproduceerd. En als er geen markt meer voor is om het semi-legaal te verkopen stoppen ze denk ik ook met produceren en gaan ze over op een nieuwe variant, om zo in het grijze gebied te blijven. Tot het spelletje uitgespeeld is.  4mmc -> 3mmc -> 2mmc enzovoorts. Al heb ik er niet zoveel verstand van. Waarom kun je bijvoorbeeld geen 1mmc of 5mmc maken? Want wat daarna als alternatief op 3mmc kwam was 3cmc en 3mma geloof ik. Dus mmc is uitgespeeld zeg maar.  Kloppen mijn redenaties enigsinds?   ",2000,45,https://drugsforum.nl/threads/research-chemicals-sterven-uit.72565/,TheRealKoekert,155945,https://drugsforum.nl/members/therealkoekert.155945/,2022-07-23
72564,drugsforum,Nooit 3MMC gedaan. Heb ik iets gemist?," Het hele 3MMC gebeuren is aan mij voorbij gegaan eigenlijk. Waarom? Omdat ik niet meer echt zo bezig was met RC's. Vroeger (Iets van 5 a 6 jaar terug ofso) wel eens 4FMP gebruikt. Maar toen was 3MMC nog niet zo populair geloof ik. Tenminste ik heb er toen nooit wat over gehoord eigenlijk. Terwijl het de afgelopen jaren toch wel heel populair was onder de jeugd. Nu sinds kort weer geinteresseerd geraakt in RC's (1P-LSD, 5-MeO-DMT en 2c-b-fly aangeschaft voordat ze dat ook gaan verbieden ) Al is dat natuurlijk heel wat anders.  Maarja 3MMC is verleden tijd nu. En ik denk dat zo een beetje alles wat nu aangeboden wordt als 3MMC (in het illegale circuit) daadwerkelijk iets anders is(?) Nu heb je wel weer RC's die erop lijken maar die schijnen toch niet helemaal hetzelfde effect te geven en mogelijk zelfs schadelijker te zijn dan 3MMC zelf.  Ik heb echt het idee dat ik iets gemist heb nu.  Of valt dat eigenlijk allemaal reuze mee? Waar lijkt 3MMC volgens jullie het meeste op? Coke met MDMA gok ik zo? En zijn er nog RC's die beschikbaar zijn die erg op 3MMC lijken? Van wat ik zo lees valt dat nogal tegen en is er geen echte vervanger voor 3MMC.   ",3000,36,https://drugsforum.nl/threads/nooit-3mmc-gedaan-heb-ik-iets-gemist.72564/,TheRealKoekert,155945,https://drugsforum.nl/members/therealkoekert.155945/,2022-07-22
72559,drugsforum,3CMC doseren en beste manier om te nemen," He mensen,  Vraag. Ik lees verschillende adviezen qua dosering en manier van nemen van 3CMC. Wat ik het meeste tegen kom is 1,5mg met KG lichaamsgewicht wanneer je 3CMC oraal neemt of plugt, Dit zou voor mij 103mg inhouden. Maar dit lijkt me erg weinig.  Ik heb namelijk al ervaring met 400mg pluggen, 450mg pluggen (maar toen kwam de helft er heel snel weer uit 💩) en laatste keer met 300mg en dat was fantastisch. Maar dat zou dus volgens de ervaringen op internet een mega hoge dosis zijn....  Heb ook ervaring met snuiven (maak gewoon lijntjes weeg dan nooit af) maar afgezien dat het effect dan kort is en mijn neus naar de klote gaat vind ik de graving bij snuiven gewoon te erg. Pluggen heeft qua effect mijn voorkeur maar ondanks voorbereiding 🚿triggert dit toch telkens ongewenst een 💩 show, wat niet wenselijk is. Meer mensen hier last van?  Bommetje slikken 1x gedaan maar voelde ik heel weinig van.  Iemand tips/ ervaringen hoe het beste te nemen en welke dosis?  Dank alvast!   ",3000,17,https://drugsforum.nl/threads/3cmc-doseren-en-beste-manier-om-te-nemen.72559/,BDF,155941,https://drugsforum.nl/members/bdf.155941/,2022-07-22
72557,drugsforum,5-MAPB, Iemand hier die bekend/ervaren is met deze RC? 5-MAPB Hoelang blijft de high werken?   ,967,6,https://drugsforum.nl/threads/5-mapb.72557/,Henk Smit,155276,https://drugsforum.nl/members/henk-smit.155276/,2022-07-22
72551,drugsforum,3-FMC," Hey,  Ik had nog nergens iemand zijn ervaring van 3fmc zien posten :  Wie : Man , 29 , te veel , verslavend karakter  Na 3 maand sober te zijn (lees : wel een pintje hier en daar maar geen chemische producten) probeerde ik eens vanalles op de legale markt van Nederland. Ik probeerde 2mmc, 3mmc, 3cmc , a-pihp, 3-fmc, 2fma, 2f-dck  Doel : Informeren  Locatie : Thuis alleen  Avondje 3fmc : Aangezien er geen tot weinig informatie over deze 'research-chemical' te vinden is was het moeilijk om de dosis te bepalen.  Op tripsit is er een schatting namelijk :  Light25-50mgCommon50-100mgStrong100-150mg  Zo dus deed ik mijn eerste insufflation op 50mg.  Gevoel : redelijk snel een pep gevoel en niet kunnen stilzitten en direct zin in een nieuwe.  20 min later : een nieuwtje van 50 mg - Redelijk seksueel opgewonden en direct zin in meer (= gevaarlijk) - Te zenuwachtig en trillingen in de hand - Redelijk brandiger in de neus maar er zijn ergere  Loop (lees : herhaling) : Om de 30 minuten een nieuwe van 50mg of meer tot op een totaal van 350 mg. Dan ben ik maar gestopt en 15mg melatonine traag in slaap gevallen. Hartrate : 130 na dosis en in rust 90. Effect : Te kort en een te nerveus gevoel VS 3mmc : Simulair gevoel maar van korte duur  Day after : Ok, geen kater maar toch een beetje een gevoel van leegheid. Helaas ben ik een zeer verslavend persoon en was de dag erachter de andere 650mg er doorgejaagd.  Conclussie : Fijn gevoel voor even, maar zeker niet de moeite waard omdat je zeer snel zeer veel wil.  Bijlage : consequenties  Ik heb nog kennis van andere chemicalien maar vraag me wel af of er nood is voor andere verslagen.   ",819,1,https://drugsforum.nl/threads/3-fmc.72551/,Mystical-Mouse,155937,https://drugsforum.nl/members/mystical-mouse.155937/,2022-07-21
72543,drugsforum,Over o-dsmt en wat het effect nou ècht is," Jongens, luister goed! O-dsmt is technisch gezien een opioide, maar het is niet als andere opioiden/opiaten. Het geeft rust in je hoofd, energie, en na een paar uur wordt het een beetje speedy. O-dsmt wordt vaak ondergescheten maar dit komt meestal door verkeerde verwachtingen. Het is niet te vergelijken met andere opioiden, niet eens met tramadol. Het zit in de klasse 'downers' maar zo voelt het niet. Wel eens tramadol geslikt, dat was een compleet ander gevoel. Rust, blijdschap, nodden. Als je o-dsmt gaat proberen, verwacht een energiek benzo-effect! Verwacht geen enorme euforie, verwacht vooral niet dat je gaat nodden. Verwacht energie en rust in je hoofd.  Moest even m'n zegje doen hoor, er is weinig over te vinden en als je iets vind is het 'saai, geen zak aan'. Het ligt aan de verwachting jongens. Veel mensen zetten het neer als een kutdrug maar dat heeft vaak puur te maken met de verwachting ervan. Het komt niet eens in de buurt van zwakke opioiden als tramadol, maar dat betekent niet dat het gelijk slecht is. Het is lekker om een film op te kijken, te niksen en gesprekken te houden (de woorden vliegen er altijd uit bij mij lol). Nou, dit begint te klinken als een soort liefdesbrief dus ik brei er maar een eind aan. Maar houd je verwachtingen op een laag pitje. Het is niet hemels, het is prima. Dat is het. Heb het idee dat er veel mensen zijn die (niet onterecht) denken dat het daadwerkelijk een opioid/opiaat-gevoel geeft maar dat doet het absoluut niet. Desondanks fijn spul, in mijn optiek in ieder geval. Verwacht niks en je hebt waarschijnlijk een lekkere tijd    ",2000,19,https://drugsforum.nl/threads/over-o-dsmt-en-wat-het-effect-nou-%C3%A8cht-is.72543/,nausea,152410,https://drugsforum.nl/members/nausea.152410/,2022-07-20
72542,drugsforum,1p-LSD 100 of 150 mcg," Hallo allemaal,   Binnenkort staat er weer een trip op de planning, dit keer met 1p-lsd.   Ik zelf heb al redelijk wat ervaring met tripmiddelen. Meerdere keren (1p) lsd, truffels, 2-cb enz. (+/- 30 keer)  Zowel op festivals, thuis binnen/buiten. De persoon met wie ik ga heeft wel enkele 2cb en truffel ervaringen maar nog geen lsd. Verder wel veel drugs ervaring in het algemeen, kan overal goed mee omgaan en ondervind nooit problemen met iets.   Het is de bedoeling om overdag deels in de bossen te trippen en later terug naar huis te gaan.   Nu is het enige tijd geleden dat ik getript heb, en twijfel ik een beetje over de dosering. Eerder pakte ik altijd 100 mcg en altijd na 20/25 minuten nog een halve blotter erbij, wat dus uitkomt op 150.  Nu heb ik opnieuw besteld en heb ik zowel blotters van 100 mcg, maar ook van 150mcg. Ik neig er dus naar om nu gewoon die van 150 te pakken, omdat dit de andere keren uiteindelijk ook is gebeurd.   Zou dit veel verschil maken omdat ik de andere keren het in 2 keer genomen heb? Of zouden jullie dit afraden of zou dit teveel zijn?   De andere keren zijn uiteraard helemaal goed verlopen, en was de trip prima maar zeker niet te heftig en heb ik dus ook nog kunnen functioneren op openbare plaatsen zoals festivals en pretpark.   Zou dit ook een prima, maar redelijk sterkte dosering zijn voor de gene met wie ik ga? Hij is gewend aan wat hogere doseringen 2cb en truffels (en andere drugs).   We willen graag een goede trip, zijn op een rustige plek in de natuur, dicht bij huis.   ",819,2,https://drugsforum.nl/threads/1p-lsd-100-of-150-mcg.72542/,Waarisdeket,156137,https://drugsforum.nl/members/waarisdeket.156137/,2022-07-19
72532,drugsforum,3-FMA tussen de pauze door?, Ik hou ongeveer 3 maanden aan als pauze tussen 6APB/MDMA gebruik. Ik vroeg me af hoeveel serotonine 3FMA verbruikt. Geldt hiervoor ook de 3 maand regel? Kan ik deze een keer tussendoor gebruiken of is dat niet aan te raden? En anders wellicht 3-FA? Thnx alvast!   ,753,5,https://drugsforum.nl/threads/3-fma-tussen-de-pauze-door.72532/,Laboratoriumrat,155085,https://drugsforum.nl/members/laboratoriumrat.155085/,2022-07-18
72526,drugsforum,3mmc eerste keer ervaring," Goedendag, Mijn eerste topic, ik hoop dat ik reacties krijg. Ik ben net 18 en heb vorige week voor het eerst x gebruikt, ik wilde wachten tot ik 18 was. Heb toen 1 & 1/4 pil op verdeeld over 11uur. Nette dosering volgens andere mensen. Gister weer een festival gepakt en begonnen met eeen heeel klein beetje m, maar was te weinig om wat te voelen. Toen kwam m’n broer met 3mmc pillen, heb 3/4 pil genomen, 1 pil was 180mg dus heb 135mg op, laatste keer had ik om 20;30 bijgenomen en duurde tot 23;00 ( ervaring staat onderin ). Daarna after gepakt omdat m’n broer zei dat ik wss toch niet kon slapen en dat merkte ik ook wel. weekje 18, 190cm, 75kg en sport vrijwel dagelijks. Mn vragen zijn nu ; -heb ik een normale dosering gehad, oraal stond er 135mg is lichte dosering, maar pillen is toch niet oraal. -is deze designer drug slechter dan x of is er daar nog te weinig over bekend? -moet ik nu hetzelfde als met x een goeie pauze nemen voordat ik weer 3mmc ga doen of kan dit 1x in de 2 weken? Bijvoorbeeld stel ik ga 2 festivals in een maand dat ik ene keer x doe andere keer 3mmc. Of beter pauze nemen van alle 2 de middelen? Heb veel topics gelezen, veel zeggen dat snuiven minder is dan pil, ik ga nooit snuiven dus ga t verschil niet weten, maar 3mmc beviel mij in ieder geval erg goed, ik was heel erg scherp en nuchter voor m’n gevoel, wel had ik heel veel energie vooral op het einde ( waarschijnlijk door dat kwartje om 20;30 ), ik ging veel praten met mensen wel minder dan met x, maar ik vond het misschien wel beter dan x, je bent niet zo spacend. Super Tof als iemand wat antwoorden heeft of linkjes etc. Alvast bedankt   ",2000,14,https://drugsforum.nl/threads/3mmc-eerste-keer-ervaring.72526/,IkweetgeengoeienAm,156115,https://drugsforum.nl/members/ikweetgeengoeienam.156115/,2022-07-17
72524,drugsforum,Wat is de sterkste RC benzo?," Hoi allemaal. Zoals mijn openingsvraag al zegt, wat is de sterkste RC benzo?  In het verleden nam ik clonazolam, dit is echter niet meer verkrijgbaar. Nu overgestapt naar bromazolam en pyrazolam. Het liefst zou ik als een blok in slaap vallen, maar dat gebeurt bij dit spul niet.  Weten jullie wat de sterkste benzo is om in slaap te vallen? Alvast bedankt.   ",2000,12,https://drugsforum.nl/threads/wat-is-de-sterkste-rc-benzo.72524/,Rebecca90,151005,https://drugsforum.nl/members/rebecca90.151005/,2022-07-17
72520,drugsforum,3mmc, Onlangs 3cmc gekocht zag er hier mensen discussie over voeren dat het niks deed heb dat eens anders geprobeert 1 dikke lijn met 0.25mg 4 fma is een dikke aanrader    ,779,6,https://drugsforum.nl/threads/3mmc.72520/,Isaac,156109,https://drugsforum.nl/members/isaac.156109/,2022-07-16
72511,drugsforum,NPS-schaalverdeling?," 3CMC lijkt sterker te lijken op MDMA, mephedrone (4mmc) sterker op snuifcocaine. Is een schaalverdeling over de effecten op zijn plaats? Oftewel; zou je effect van sommige research chems op een schaalverdeling kunnen zetten?  Dan zou je volgens mij krijgen:  MDMA-------3CMC –3MMC—4MMC -----cocaine  Waarom wel/niet? Iemand? Thxx   ",963,9,https://drugsforum.nl/threads/nps-schaalverdeling.72511/,Psychotropica,156100,https://drugsforum.nl/members/psychotropica.156100/,2022-07-15
72503,drugsforum,Pagoclone, Is pagoclone   een  zwak spul of is het voor de prullenbak. Vorig jaar  gebrobeerd en niets van gemerkt .  Vandaag nieuwe test uitvoeren.   ,565,3,https://drugsforum.nl/threads/pagoclone.72503/,Eburoon zuiden van kempen,156088,https://drugsforum.nl/members/eburoon-zuiden-van-kempen.156088/,2022-07-13
72500,drugsforum,Invriezen van poeders," Hoi ,  zou je Flubromazepam POEDERS kunnen invriezen? Eerst vakuum trekken en daarna de vriezer in . ( Geen pellets )  Ik denk het wel  ?  Groetjes   ",616,17,https://drugsforum.nl/threads/invriezen-van-poeders.72500/,Eburoon zuiden van kempen,156088,https://drugsforum.nl/members/eburoon-zuiden-van-kempen.156088/,2022-07-13
72494,drugsforum,psilocibin psilocin en de chemische variant," Beste allen,  Ik ben zeer geintresseerd in psilocibin. Zeg ik het goed dat psilocibin een natuurlijke molecuul is en dat het in het menselijk lichaam omgezet wordt in psilocin?  Nu begrijp ik dat alle N,N-dimethyltryptamine varianten verboden zijn, dat houdt o.a. in 4-aco-dmt en 4-ho-dmt (en welke nog meer?) en dus niet te verkrijgen zijn via legale wegen, althans na een middagje speuren vindt ik niks.  Welke rc komt er volgens jullie het dichts bij de oorspronkelijke vorm?  Dank.   ",365,1,https://drugsforum.nl/threads/psilocibin-psilocin-en-de-chemische-variant.72494/,Erikkie,154504,https://drugsforum.nl/members/erikkie.154504/,2022-07-12
72493,drugsforum,RC zonder serotonine release," Ik ben op zoek naar een RC die zoals 4-fma etc werkt, maar dan met veel minder of geen release van serotonine. Nu komt die blijkbaar bij 4-fma aardig wat vrij (al merk ik amper een kater 150mg oraal gebruik).  Wat raden jullie aan? En wat voor dosis zou ik dan moeten pakken gezien mijn hoeveelheid inname 4fma om beetje op hetzelfde niveau te komen?   ",2000,9,https://drugsforum.nl/threads/rc-zonder-serotonine-release.72493/,Druggers,155136,https://drugsforum.nl/members/druggers.155136/,2022-07-12
72487,drugsforum,candyflip rc s, Als ik een candyflip met 1p-lsd 150 ug wil doen is 6 apb dan de beste vervanger voor mdma of 5 mapb of 5 apb kwa werking en tijd .   ,1000,13,https://drugsforum.nl/threads/candyflip-rc-s.72487/,ricorieks,152144,https://drugsforum.nl/members/ricorieks.152144/,2022-07-11
72480,drugsforum,Stoppen na 4 weken dagelijks gebruik 4F-MPH. Wat staat me te wachten?," Beste DF'ers,   heeft er iemand ervaring met dagelijks gebruik van 4F-MPH? Ik vermoed van wel...ik gebruik het echter in een hoge dosering nl 120 mg per dag met om de paar dagen es een uitschieter richting 300 a 400 4F-MPH, maar meestal netjes 120 mg.   Ik zou willen weten welke ontwenningsverschijnselen ik kan verwachten na het stoppen van 4F-MPH na 4 weken dagelijks gebruik....  Heeft iemand hier een beetje zicht op? Zou ik Cold  Turkey hiervan durven gaan? Ik heb voor de rest ervaring met andere stims...ben redelijk zwaar verslaafd en gebruikte de 4F-MPH eigenlijk om niet aan andere stims te komen. Dat doel lukt maar ik word redelijk gek van telkens te trachten niet boven de 120 mg te gaan en dat mislukt soms...   ",2000,13,https://drugsforum.nl/threads/stoppen-na-4-weken-dagelijks-gebruik-4f-mph-wat-staat-me-te-wachten.72480/,Fairflower,152029,https://drugsforum.nl/members/fairflower.152029/,2022-07-09
72455,drugsforum,Gezondheidsgevaren RC’s ?," Wat zijn de gevaren van RC’s? Bij alle RC’s staat vermeld dat ze de gezondheid ernstig kunnen schaden en niet geschikt zijn voor consumptie. Toch worden ze verkocht, al is een aantal ‘ merken’ inmiddels verboden. Kan nergens vinden wat die gezondheidsrisico’s zijn. Ben er zeer voorzichtig mee, maar heb er nu één gevonden waar ik goed op slaap en helder van wakker word. Zou heel graag meer over de gevaren willen weten. Is het schadelijk voor maag, darmen of longen? Hoor graag van of iemand daar meer van weet. Kan het op internet niet vinden. Wél dat het schadelijk is.   ",2000,14,https://drugsforum.nl/threads/gezondheidsgevaren-rc%E2%80%99s.72455/,Birga01,155915,https://drugsforum.nl/members/birga01.155915/,2022-07-07
72453,drugsforum,3mmc - dosering, Wat is een beetje een normale dosering van 3mmc? Ik zie mensen hier 1-3 gram wegwerken dat lijkt me overdreven.   Ik heb het een keer eerder genomen met 190mg. Begonnen met een halve en toen telkens kwartjes bij elke twee uur ongeveer.   Zou je prima twee pillen (380mg totaal) op een avond kunnen nemen en nu de tweede keer dus wat hoger kunnen innemen?   Ben 80kg   ,2000,27,https://drugsforum.nl/threads/3mmc-dosering.72453/,jackhan,155367,https://drugsforum.nl/members/jackhan.155367/,2022-07-07
