thread_id,forum,title,content,views,comments,url,username,user_id,user_url,date
72760,drugsforum,Alleengebruikers 3mmc," Vragenlijst Hallo allemaal, ik heb een vragenlijst gemaakt voor alle mensen die graag 3mmc in hun eentje gebruiken en het snuiven. Het is geen enquete/project voor school of werk, maar gewoon mijn eigen nieuwsgierigheid en zoektocht naar herkenning. Omdat iedereen hier vrij uit kan praten zonder in de problemen te komen met werk/vrienden/familie leek dit mij het ideale platform.   Het begin  1. Hoelang geleden ben je in aanraking gekomen met 3mmc? 2. Hoe oud was je toen je je eerste lijntje nam?  3. Wat maakte dat je het wilde gebruiken?  4. Wat was je eerste indruk van het effect?  5. Wat vond je fijn om te doen in de eerste paar uur?  6. Wat vond je fijn om te doen na de eerste paar uur?  7. Heb je praktische dingen geleerd tijdens je momenten van gebruik? Zo ja, heb je daar in het nuchtere dagelijkse leven profijt van?  8. Heb je persoonlijke dingen geleerd tijdens je gebruik? Zo ja, heb je daar in het nuchtere dagelijkse leven profijt van? 9. Heb je last van adhd, borderline, een eetstoornis of negatief zelfbeeld? 10. Ben je open over je gebruik, is het een geheim, of weet 1 iemand ervan?  11. Heb je de angst nooit meer gelukkig te kunnen worden zonder?   12. Vind je het terecht dat 3mmc verboden is geworden?   Niet recreatieve momenten  1. Wat maakte dat je besloot om op een doordeweekse dag (wellicht tijdens werk of dagjes uit) te gaan gebruiken?  2. Genoot je van deze momenten? Of was je alleen maar bezig met momenten kiezen om bij te kunnen pakken?  3. Ben je ooit betrapt op je gebruik?  4. Voelde je je schuldig aan het eind van de dag?  5. Voelde je je alleen in het gebruiken op dit soort momenten?  6. Had je behoefte aan gesprekken met mensen die met hetzelfde geheim rondlopen?  7. Ben jij het type waar niemand van verwacht dat je onder invloed deelneemt aan het dagelijks leven? 8. Gebruikte je iets om tussendoor in slaap te komen? Zo ja, wat? 9. Heb je ooit een relatie gehad waarin je altijd stiekem onder invloed was?  10. Kijk je weleens terug met spijt naar momenten waar je onder invloed was? 11. Wat vond je het vervelendst aan deze periodes?  12. Heb je behoefte aan pakken als je je rot voelt of ook als je je gewoon oke voelt?   Recreatieve momenten  1. Hoe voelde je je gedurende de week als je wist dat je vrijdag weer mocht gaan gebruiken?  2. Maakte je je weleens zorgen om deze gevoelens?  3. Hoe reageerde je lichaam 2 uur voor het moment daar was?  4. Hoelang genoot je daadwerkelijk van het effect na het gebruiken?  5. Baalde je op een bepaald punt dat je met vrienden was? Of misschien zelfs dat je partner er was? 6. Koos je ervoor om tussendoor te gaan slapen, zodat je de dag erna nog even het restje kon opmaken? En dus weer wat energie had om meer effect te hebben 7. Kwam het weleens voor dat je die dag toch weer ging bijhalen omdat je net te kort kwam voor die hele dag?  8. Zorgde dit ervoor dat je het veel te laat maakte en je de volgende dag als een zombie op je werk stond? Of misschien wel nog een dagje er achter aan plakte?  9. Had je na een weekend recreatief gebruik weleens helemaal genoeg van 3mmc?  10. Was dit op donderdag meestal weer over?    Toxic vragen   1. Gaf het je een kick om op bepaalde plekken bij te pakken?  2. Wat is de meest gekke plek waar je ooit een lijntje hebt gelegd?  3. Heb je nog een bepaalde fantasie die je waar wilt maken voordat je stopt met gebruik?  Vervelende maar belangrijke vragen  1. Heb je de wens om er binnekort mee te stoppen?  2. Ben je misschien al gestopt en wil je kwijt hoe het nu met je gaat?  3. Ben je vanplan, mocht je kinderen willen, om ze ooit te vertellen over jouw drugsverleden?  4. Wat is voor jou de ultieme reden om te stoppen?  5. Geloof jij in ‘nooit meer’ of houd jij de deur nog altijd op een kiertje?  6. Als 3mmc geen schade zou brengen aan je lichaam en geest, en er geen tolerantie zou zijn, zou je het dan voor altijd willen gebruiken?  7. Als je terug kon in de tijd, zou je je eerste lijntje dan ongedaan maken?  8. Hoe zou je er als ouder mee omgaan als jouw kind drugs wilt uitproberen?  9. Zou je stoppen na een overdosis overleeft te hebben?  10. Ben je weleens bang voor de nog niet bekende lange termijn risico’s?   Ik ben erg benieuwd naar de reacties, ik verwacht er niet meteen veel te krijgen aangezien het vrij directe vragen zijn. Maar niemand weet wie je bent dus brand los    ",2000,20,https://drugsforum.nl/threads/alleengebruikers-3mmc.72760/,Beschermbengel,156336,https://drugsforum.nl/members/beschermbengel.156336/,2022-08-22
72754,drugsforum,Hulp bij het kiezen van de juiste substantie," Hello!  Welke stof verhoogt het libido het meest? Ik ben op zoek naar een vervanger voor 4-cmc en 3-mmc - met deze stoffen veranderde ik in een seksdier, ik kon de hele nacht met mijn partner doorbrengen, zonder paniekaanvallen, helaas zijn ze niet langer legaal .  Ik heb 3-cmc, 2-mmc, 3-fa, 2-fa, 2-fma, Ethyl-Pentedrone (NEP) geprobeerd.  NEP had het sterkste stimulerende effect op het libido, maar het heeft een enorm nadeel - het maakt niet uit of ik elke keer 20 mg of 100 mg intranasaal inneem, net nadat ik het ongeveer 20 minuten heb gegeven, klopt mijn hart heel snel (ongeveer 180 bpm), dan mijn hart komt tot rust, maar de werking van de stof neemt ook snel af.  Bij 3-cmc merkte ik ook een effect op het libido, maar vrij klein (maar veel groter dan in het geval van 2-mmc, 3-fa, 2-fa, 2-fma), om een bevredigend effect te voelen moet ik neem doses van ongeveer 200 mg in één keer intranasaal in eerste instantie, direct na het snuiven, veroorzaakt het soms lichte paniekaanvallen die vrij snel verdwijnen.  Ik neem de stof ongeveer een keer per maand, soms minder vaak. elke keer intranasaal.  Welke legale RC op de markt zou het beste zijn? Misschien is a-PiHP het proberen waard?  Sorry voor spelfouten, maar ik ben Nederlands aan het leren  Alvast bedankt voor uw hulp!   ",3000,20,https://drugsforum.nl/threads/hulp-bij-het-kiezen-van-de-juiste-substantie.72754/,VerticalMode,153258,https://drugsforum.nl/members/verticalmode.153258/,2022-08-21
72752,drugsforum,Manieren van consumeren. Freebase/Hydrochloride/Fumarate, Even kijken of ik alles zo goed in mijn hoofd heb zitten.  Freebase is om te roken/vapen. En dat is het enige wat je ermee kan volgens mij. Hydrochloride is om te snuiven. Maar kun je ook slikken? Fumarate om te slikken. Maar kun je ook snuiven?  Klopt het zo wat ik hier zeg? Qua injecteren/pluggen heb ik al helemaal geen idee. Maar doe dat zelf toch niet.   ,518,2,https://drugsforum.nl/threads/manieren-van-consumeren-freebase-hydrochloride-fumarate.72752/,TheRealKoekert,155945,https://drugsforum.nl/members/therealkoekert.155945/,2022-08-21
72748,drugsforum,welke research benzo test niet positief op screening ?, Hoi .  Graag zou ik weten welke research benzodiazepine niet positief test op een klassieke  urine controle . Hierbij weet ik dat zopiclon of zolpidem zeker niet test maar is niet echt een angstremmer ... Zit namelijk enorm met angsten soms . Benzo's zoals etizolam positief of negatief ??    Hierbij wil ik jullie alvast bedanken voor de informatie. Ik ben jullie eeuwig dankbaar !!!!    ,253,1,https://drugsforum.nl/threads/welke-research-benzo-test-niet-positief-op-screening.72748/,xanaxke,152760,https://drugsforum.nl/members/xanaxke.152760/,2022-08-20
72746,drugsforum,Welke rc’s kan ik doen zonder positief te scoren op drug testen?, Ik word getest op amfetamine cocaïne mdma ghb wiet en opiaten. Ik slik anti depressiva en anti psychotics dus psychedelics zit er niet in.  ik gebruik nu dagelijks odsmt en heb een paar keer opce en 3meopcp gedaan maar word dit nou een beetje beu.   ,591,5,https://drugsforum.nl/threads/welke-rc%E2%80%99s-kan-ik-doen-zonder-positief-te-scoren-op-drug-testen.72746/,benzzzy,123119,https://drugsforum.nl/members/benzzzy.123119/,2022-08-20
72745,drugsforum,"Een kijkje in het Nederlandse lab waar 1P-LSD, 1B-LSD, 1-cP-LSD en 1V-LSD worden gemaakt", VICE in Duitsland heeft een minidocu gepubliceerd over lysergamides. Ze hebben ook een interview met degene die in Nederland psychedelica maakt. Uniek inkijkje in de productielocatie van rc-lysergamides dus!      ,843,7,https://drugsforum.nl/threads/een-kijkje-in-het-nederlandse-lab-waar-1p-lsd-1b-lsd-1-cp-lsd-en-1v-lsd-worden-gemaakt.72745/,Neo-Shulginist,145222,https://drugsforum.nl/members/neo-shulginist.145222/,2022-08-20
72738,drugsforum,"2-FDCK, constant scheel kijken"," Hey mensen,  Iemand anders ook een soortgelijke bijwerking ondergaan met 2-FDCK? Fijn spul om af en toe te gebruiken, ook leuke hallucinaties krijg ik ervan echt apart. Maar zelfs film kijken word voor mij erg moeilijk omdat ik echt SUPER scheel ga kijken wat in combinatie met slechte coordinatie niet zo fijn is, zou deze drug ook net als bvb alcohol met je ogen knoeien na een bepaalde dosering? Er is bij mij in de familie wel iemand die rond zijn 50ste al iets had met zijn oogspieren en is daaraan heel vaak geopereerd, hoop niet dat ik dit wat later in mijn leven ook krijg     ",935,8,https://drugsforum.nl/threads/2-fdck-constant-scheel-kijken.72738/,Practuna,134518,https://drugsforum.nl/members/practuna.134518/,2022-08-19
72734,drugsforum,"Bromazolam, , Pyrazolam", Welke van bovenstaande rc’s heeft de langste werkingsduur en welke de langste halfwaarde tijd?  Graag als het kan concrete antwoorden. Bedankt.   ,594,4,https://drugsforum.nl/threads/bromazolam-pyrazolam.72734/,De Dunne,80006,https://drugsforum.nl/members/de-dunne.80006/,2022-08-18
72730,drugsforum,Laatste keer RC's bestellen?," Beste Drugsforum leden,   De afgelopen tijd hebben RC's mijn leven een stuk interessanter gemaakt. Gedaan met de bullshit straat dealers met hun uitgedroogde Rode Draakjes, hun Witte Reus cocaine en hun Saridon xtc! Even pauze van de smartshops met hun oosterse keukenkruiden! Conimex is er niks bij! En die Kilo Utrecht Tango coffeeshops met hun 'bijdehandte' personeel!  Met 3MMC heb ik veel lol gehad. Opeens gingen we intraveneus... dat was nieuw. Met lysergamiden nog veel meer... weten jullie Drugsforummers, Amsterdan Nieuw West is misschien niet de beste setting voor P-LSD! Maar Jee-zus! (dit is niet de Naam Des Heeren ijdel gebruiken!) Wat een trip!   Dat wil ik nu nog een keer. Helaas gaat de RC deur naar aan zekerheid grenzende waarschijnlijkheid volgende maand op slot!  Ga vandaag RC's bestellen bij mijn vendor voor de laatste keer. Had al een lijst gemaakt, maar ben me niet zeker of ik niet andere dingen moet bestellen. Ook wil ik weten hoe bezorging bij een afhaalpunt werkt, want ik wil niet dat mijn verblijfadres op een of andere wijze post krijgt van mijn vendor en mijn eigenlijke postadres wil ik niet nog een keer gebruiken voor mijn RC bestelling. Het is nu 9:03 en de kantoorboekhandel is open dus ik kan het zo vragen.  Wat zouden jullie bestellen?  Zeker ga ik Lysergamiden bestellen en 6APB, omdat ik nog nooit ge-candyflipt heb. Plus wat disso's. En misschien wat NEP en pyro's (risico op verslaving benadert bij mij de 0).  Maar ik ben me toch verder niet zeker. Is iets waar je meer van wilt nemen per se de moeite waard? (MAL) Kan ik beter 5 zakjes P-LSD bestellen of van alle RC's die ik nog wil een?  Gaan jullie nog bestellen? Wat? En wat zouden jullie doen?   ",7000,94,https://drugsforum.nl/threads/laatste-keer-rcs-bestellen.72730/,Casrus,154535,https://drugsforum.nl/members/casrus.154535/,2022-08-18
72729,drugsforum,RC aanraders," Goeden nacht iedereen op DF. Ik ben na lange tijd weer van plan om wat RCs te gaan bestellen en ik vroeg me af of jullie nog leuke aanraders hebben, uppers, downers, maakt niet uit wat. Met vriendelijke groet, henkie.   ",3000,46,https://drugsforum.nl/threads/rc-aanraders.72729/,Henk Smit,155276,https://drugsforum.nl/members/henk-smit.155276/,2022-08-18
72724,drugsforum,Gevolgen te vaak 3CMC, Wat zijn de gevolgen van te vaak 3cmc gebruik en cobra? Dit meestal zo een uur of 8 achter elkaar. Met tussenpauzes uiteraard en genoeg water drinken. Iemand toevallig ooit iets meegemaakt? We vinden het te lekker en moeten er echt mee gaan oppassen. Maar soms net als deze week hebben we het dus al 2 x gedaan. En dan ook een nacht doorgehaald en volgende dag weer doodmoe naar werk...   ,3000,25,https://drugsforum.nl/threads/gevolgen-te-vaak-3cmc.72724/,Cherees,155708,https://drugsforum.nl/members/cherees.155708/,2022-08-17
72712,drugsforum,6-APB na vroeger MDMA misbruikt te hebben., Heb in een ver verleden (10 jaar terug ofso) teveel en tevaak MDMA gebruikt. Het was dan elke maand wel raak en de dosis ging steeds maar omhoog. (Je bent jong en je wil de grens opzoeken) Totdat het ineens eigenlijk amper nog chill werkt. Toen kwam het besef dat ik het voor mijzelf aan het verneuken was. En vanaf dat moment nog maar 1 a 2 keer per jaar MDMA gebruikt en ook een wat normalere dosis (1.5 tot 2 pillen max over een heel feest). En het euforische gevoel is in de loop der jaren wel enigsinds terug gekomen. Alhoewel dat voornamelijk bij de eerste dosis is.  Anyway nu wou ik weer wat RC's gaan bestellen en zag ik 6-APB staan. Opzich wil ik het wel eens proberen. Maaar misschien kan ik het maar beter laten gezien mijn geschiedenis? 6-APB werkt namelijk een stuk langer dan MDMA. Klinkt leuk maar het zal je serotonine receptoren waarschijnlijk ook zwaarder belasten. Het euforische zal in mijn geval ook wel niet heel lang duren denk ik. Verstandig om 6-APB dan maar over te slaan om mijn serotonine receptoren niet verder te verneuken? Of zal het weinig uitmaken die 1 a 2 keer per jaar dat ik dan nog serotonine releasers gebruik?   ,1000,8,https://drugsforum.nl/threads/6-apb-na-vroeger-mdma-misbruikt-te-hebben.72712/,TheRealKoekert,155945,https://drugsforum.nl/members/therealkoekert.155945/,2022-08-15
72698,drugsforum,6-APB+2C-B, Ghehe ben ik weer wat betreft de 6-APB combo..   De keuze voor zaterdag (Landjuweel btw.) is gevallen op de combo 6-APB gevolgd door 2C-B. Iemand hier die daar (een goede) ervaring mee heeft?  Ben van plan de 2C-B te droppen tijdens de 6-APB comedown (niet direct na de piek maar 1 of 2 uur erna). Ik neem een vrij milde dosis 2C-B want hoef niet de ballen uit m'n broek te trippen en zo geeft de 2C-B als het goed is ook meer energie dan bij een hogere dosis.   ,581,3,https://drugsforum.nl/threads/6-apb-2c-b.72698/,Bowserman,150675,https://drugsforum.nl/members/bowserman.150675/,2022-08-11
72688,drugsforum,6-APB combo met upper (speed of 4-FA)," Dag beste mensen!  zaterdag ga ik naar een festival en ben van plan om 6-APB te nemen. Ik vind 6-APB super chill, duurt bij mij zo'n 1.5 uurtjes na inname voordat het effect op komt zetten en piekt daarna heel constant ongeveer 4 uur waarna het effect nog zo'n 2-3 uurtjes afzwakt.  De hele constante high vind ik erg relaxed vergeleken met XTC. Met XTC neem ik meestal kwartjes en ben ik veel meer bezig met ""zal ik nu bijnemen"", ""is dit het goeie moment of is het nu nog te vroeg"", ""heeft bijnemen nog zin of ben ik door m'n serotonine heen"", per ongeluk te hard gaan, etc. Met 6-APB heb ik dit allemaal totaal niet, één capsule erin aan het begin en verder lekker genieten. Ik weet dat er ook mensen zijn die meerdere doses nemen op een avond maar daar heb ik zelf geen ervaring mee.  Het enige nadeel aan 6-APB vind ik het ""couch-lock"" effect. Ik krijg meer zin om te hangen, te chillen, te praten en naar de muziek te luisteren dan dat ik er een bom energie van krijg, waardoor ik vaak ook niet per se veel zin heb om te dansen, terwijl ik normaal Sir Dance-a-Lot ben.  Vandaar dat ik met de gedachte speel om 6-APB met een upper als speed of 4-FA te combineren. Ik kwam hierover op het forum wel wat topics tegen maar die waren wel heel erg oud dus ik vroeg mij af of er hier mensen zijn die positieve (of negatieve) ervaringen mee hebben met genoemde combo's. Ik ben me ervan bewust dat het combineren van bijv MDMA en speed de neurotoxiciteit verhoogd, en ik neem aan dat dit ook geld voor de combo's 6-APB en speed of 4-FA. Ik hoef niet kneiterhard te gaan dus ik doseer sowieso niet super hoog, dus tenzij er gevallen bekend zijn van mensen die meteen dood neervielen door deze combo's ben ik wel bereid om wat te experimenteren. Ik neem sowieso altijd veel vitamientjes, anti-oxidantjes en eet van tevoren goed om de schade zoveel mogelijk te beperken.  Goed, ben erg benieuwd of iemand hier ervaring mee heeft en deze wil delen!  ps. Als de piek van de 6-APB afneemt wil ik er nog een (halfje) 2-CB in gooien, lijkt mij een mogelijk leuke variant van een RC Schulgintje. Ben benieuwd of het synergie heeft met de zogenaamde psychedelische effecten van 6-APB (welke ik zelf nooit heb ervaren, maar aldus psychonautwiki).  Thanks all!   ",1000,12,https://drugsforum.nl/threads/6-apb-combo-met-upper-speed-of-4-fa.72688/,Bowserman,150675,https://drugsforum.nl/members/bowserman.150675/,2022-08-09
72671,drugsforum,Werd me aanbevolen..., Voor sex en porno...  Extase Explosion Vanilla met 5 MAPB en 3CMC....   of  4-FMA   of  3-FA  Wat denken jullie.... alvast bedankt  P.S. ook Mephydrone werd me aanbevolen...   ,1000,28,https://drugsforum.nl/threads/werd-me-aanbevolen.72671/,Readerboy788,156256,https://drugsforum.nl/members/readerboy788.156256/,2022-08-07
72666,drugsforum,RC en bijwerkingen / katers, hoe reageren jullie lichaam op sommige Rc stoffen ?  welke stim RC stof geeft de minste bijwerkingen en welke de meeste bijwerkingen ?  ik kan mij niet voorstellen dat je dit dagelijkd kunt gebruiken zonder de bijwerkingen / katers ?  werken benzo goed tegen de bijwerkingen ervan ?   ,1000,26,https://drugsforum.nl/threads/rc-en-bijwerkingen-katers.72666/,madhatter,155992,https://drugsforum.nl/members/madhatter.155992/,2022-08-06
72652,drugsforum,4 fma poeder, Hallo ik had ee vraag. Ik heb net 4fma binnen gekregen. Maar het is poeder. Is het dan bedoeld om te snuiven want dat heb ik nooit van mn leven gedaan. Ik neem altijd oraal. Snuiven gaat mij toch iets te ver iemand die hier ee atwoord op heeft? alvast bedankt   ,1000,6,https://drugsforum.nl/threads/4-fma-poeder.72652/,Saab,154712,https://drugsforum.nl/members/saab.154712/,2022-08-05
72649,drugsforum,Last van handen na 3mmc/4mmc," Dag forumleden,  Afgelopen weekend heb ik weer eens wat door de neus geslingerd. Ongeveer 1 tot 1.5 gram aan 3mmc over een tijdsspan van rond de 20 uur. Ik heb regelmatig bij het gebruik last van mijn handen, na ongeveer 14 uur. Die lijken dan ook een stuk dunner, net als mijn polsen. Dat is voor mij dan meestal een teken van dat ik naar huis moet. Drinken let ik wel op, eten vergeet ik meestal pas tot het te laat is. En dan is het buikpijn lijden. Natuurlijk logisch als je lang niks hebt gegeten. Na deze keer heb ik eigenlijk de hele week erna nog last van mijn handen gehouden. Bijvoorbeeld als ik mijn vingers strek heb ik last van het midden van mijn handpalm aan de binnenkant en het voelt allemaal nog steeds erg stroef aan. Nu weet ik dat vasoconstrictie vaker mijn vijand is geweest, maar dit voelt toch net iets anders aan. 5 dagen na het feestje zijn mijn zielige polsjes nog erg dun, wat ik merk aan het festivalbandje dat eraan zit. Die kan ik normaal niet makkelijk heen en weer verschuiven, maar nu dus wel.  Ik weet dat er een aantal research-genieën op dit forum zitten dus ik vroeg me af of iemand weet hoe dit kan en of iemand hier ervaring mee heeft. Niemand die ik tot nu toe gesproken heb kan mij een verklaring geven, en daar zitten die-hards tussen die 3 keer mijn hoeveelheid gebruiken.  Bij voorbaat dank!   ",587,3,https://drugsforum.nl/threads/last-van-handen-na-3mmc-4mmc.72649/,Datisgekzeg,155078,https://drugsforum.nl/members/datisgekzeg.155078/,2022-08-04
72647,drugsforum,3-FMC alternatief voor seks opwekking," Ik heb jaren geleden ervaring met 3FMC. Dat was geweldig want je werd er beregeil geil van en heb toen mijn vriendin alle hoeken van de woonkamer, keuken, slaapkamer, kelder en zolder laten zien. Ja nu nog.... als ik er over begin, kijkt ze mij verliefd vol verukking aan met een boodschap in d'r ogen van ehh...'wanneer gaan we weer?' Ik heb dus een missie te volbrengen! Nou is 3FMC nog maar sporadisch te krijgen, maar weet iemand een goed alternatief? En het liefst met minimale cravings en kater gevoel de volgende dag.  Bij 3FMC was het craving gevoel hoog en moest je om de 30 minuten bijtanken. Een avond seks met dit spul was goed voor een gram door je neus. Dat is veel en ik zou het graag beperken tot 4 a 5 snuifjes in totaal. Dat je daar mee aan toe komt. De volgende dag merkte je wel dat er een aanslag op je lijf en geest had plaats gevonden. Nou zou ik dat liever niet willen. Maar misschien is dat wel een utopie, want bijna elke drug heeft z'n negatieve bijwerkingen.  Maar wie weet. Wie kan mij een goed alternatief aanraden? Dank.   ",1000,23,https://drugsforum.nl/threads/3-fmc-alternatief-voor-seks-opwekking.72647/,Remymansch,151571,https://drugsforum.nl/members/remymansch.151571/,2022-08-04
72642,drugsforum,NEP N-Ethylpentedrone      M_nus," NEP N-Ethylpentedrone zuiverheid volgens vendor 99% ?   Reagent tests ( Morris A + B , empty , Liebermann , Robadope A + B , Simons A + B , Marquis )   3 lijnen van 0.020mg gedaan om de 60minuten geen branderig gevoel in neus.  kleine high ( 3/10 scaal voor mij )  gevoel met angst / paniek , paranoia , hoofdpijn , hartkloppingen , borstpijn , uit de venster kijken , 3 uur zitten staren op gsm , gevoelig voor licht en geluiden , zag soms zo lichtflitsen in de hoeken van mijn ogen waardoor ik paniekerig werd  closed eyes visuals van wormen voor in slaap te vallen , er niet gemakkelijk op kunnen slapen   de dag erna :  hoofdpijn , misselijkheid , vermoeidheid , focus , angst , rare geuren , pijn achter de ogen  katergevoel 6/10   """"voor mijn mening"""" niet echt mijn ding maar kan wel begrijpen dat dit voor sommige gebruikers als iets leuks kan gevonden worden maar voor mij totaal niet.  misschien moet ik meer nemen maar dan zal het de neveneffecten nog versterken     ",2000,12,https://drugsforum.nl/threads/nep-n-ethylpentedrone-m_nus.72642/,madhatter,155992,https://drugsforum.nl/members/madhatter.155992/,2022-08-03
72641,drugsforum,RC kwaliteit stoffen ?," seg ik had een vraagje ,  zijn er mensen die iedere RC laten testen in een labcentrum en dan ook met reagents. en zit de zuiverheid dan ook altijd op een laag gemiddeld ofzo?  ik heb wat reagents van NEP maar zou niet weten waar naar kijken met die kleurtjes en mensen hebben mij een vendor aanbevolen maar misschien is dit bait and switch geweest ?   graag eventjes info erover danku   ",1000,19,https://drugsforum.nl/threads/rc-kwaliteit-stoffen.72641/,madhatter,155992,https://drugsforum.nl/members/madhatter.155992/,2022-08-03
72632,drugsforum,2CB-FLY trip report," Hoi allen,  Om te beginnen, ik heb al heel lang niks meer gepost op dit forum maar heb met regelmaat wat threads doorgelezen en erg veel geleerd. Dank aan jullie allen voor de kwaliteit van dit forum.  In september ga ik naar een 5 daags psytrance festival (Psy-Fi, waarschijnlijk gaan een aantal van jullie ook 😊) en heb 3 RC's besteld om een mooie/interessante tijd te mogen beleven. Nu ik vakantie heb wil ik even uitproberen hoe deze middelen vallen. Ik ben een voorzichtig persoon en hou ervan om een beetje te weten wat me staat te wachten.  Gisteren 10mg 2CB-FLY rond 14:00 ingenomen. Muziek op en een grote wandeling gemaakt. Een uur later lag ik in een park naar de lucht te staren, maar kon niet zo goed bepalen of er al iets te merken was. Werd een beetje rusteloos. Maar weer naar huis gewandeld. Om 16:00 weer thuis en net daarvoor begonnen de eerste effecten zich voor te doen. Verscherpt zicht, intensere kleurtjes en wisselend warm / koud. De wind voelde intens op mijn huid. De muziek was erg mooi. Kippenvelmomentjes 😊  Thuis was ik kapot van de wandeling. Ik heb een beetje een probleem met dagelijks kratom gebruik en aangezien het word afgeraden dit te combineren met 2CB-FLY had ik de hele dag nog geen kratom genomen. Ik voelde me gestimuleerd maar tegelijkertijd moe van lichte afkick verschijnselen die werden versterkt door de 2CB-FLY. Tenminste, zo ervaarde ik het. Voelde me prettig en naar tegelijk.  In bed gaan liggen met muziek op. Heel lichte patroontjes met ogen dicht. De dekens voelde erg fijn. Opeens uit het niets een erotisch gevoel. Een half uur mezelf hiermee vermaakt en daarna gedoucht. Het water voelde fijn.  Na de douche werd ik het een beetje zat. Toch maar eens 4gr kratom naar binnen gegooid. Toen dat begon te werken voelde ik mij eindelijk een beetje fijn.   Nog lang entactogene effecten en verscherpt zicht met diepere kleurtjes gezien. Het beeld van mijn telefoon was zo ontzettend mooi, maar wist niet meer zo goed wat ik wou kijken of doen. Ontspannen wou nog lang niet. De stimulatie leek oneindig lang door te gaan. Om 22:00 naar bed, maar nog steeds erg gestimuleerd. Nog wat kratom genomen en uiteindelijk pas rond 1:00 beetje slaperig.   Volgens mij is dit echt iets dat je samen met iemand moet ervaren en lekker met elkaar knuffelen enzo. In je eentje is het een beetje ongemakkelijk. Tenminste, voor mij wel.   Voordeel vond ik dat mijn headspace normaal bleef. Ik voelde mij gewoon nuchter en kon normaal denken. Wat dat betreft wel goed voor een festival!   Ik heb gelezen dat veel mensen het ervaren als een middel tussen mdma en lsd in en dat is wel een redelijk goeie omschrijving. Ik heb ook gelezen dat veel mensen euforie ervaren, dat was voor mij niet zo. Mogelijk door de kratom afkick verschijnselen 🤷‍♂️  Niet het meest boeiende report, maar wou dit toch even delen.  Fijne dag allen en nogmaals dank voor dit geweldige forum!   ",2000,18,https://drugsforum.nl/threads/2cb-fly-trip-report.72632/,Starshine,131189,https://drugsforum.nl/members/starshine.131189/,2022-08-02
