thread_id,forum,title,content,views,comments,url,username,user_id,user_url,date
73088,drugsforum,Kan je 6-apb snuiven," Hoi iedereen,  Ik gebruik al sinds mijn veertiende. Dan heb ik het over de gebruikelijke drugs; cocaïne, speed, xtc, mdma, eigenlijk zo goed als alles. Alleen heb ik geen heroïne gedaan en nooit intraveneus gebruikt. Dus oraal of nasaal. Soms zelfs brokken coke anaal. Sinds een tijdje hoor ik meer en meer over research chemicals. Dus ik dacht, waarom niet? Een vriend van me had afgelopen zomer 3cmc gebruikt en vertelde me dat dit wel leuk was.  Natuurlijk als de impulsieve idioot die ik ben bestel ik meteen 20 gram van dat spul. Eerlijk gezegd, de grootste rotzooi wat we bestaat. Snuiven is de hel!! Vroeger heb ik wel eens speed genomen die pijn deed maar dit was echter een warme douche op een koude winterdag in vergelijking met het snuiven van 3cmc.  Vandaar mijn besluit om er bommetjes en capsules van te maken. Lees wel capsules van ongeveer 250 mg, waar ik er drie van nam.  En ik voelde er lichtjes een warm gevoel van, zoals een xtc-pil uit de jaren '00 die op begint te komen.  Helaas bleef het hierbij. Dikke shit dus!  Ik heb nu 6apb, 2cb, 2fma en 4fma besteld. Heeft iemand ervaring met het snuiven hiervan en de effecten want ik lees heel tegenstrijdige betichten.  Alvast bedankt   ",697,19,https://drugsforum.nl/threads/kan-je-6-apb-snuiven.73088/,Jelle666,156762,https://drugsforum.nl/members/jelle666.156762/,2022-10-10
73077,drugsforum,5-meo-dmt hcl kleur, Bij een legale vendor heb ik onlangs 5-meo-dmt freebase en 5-meo-dmt hcl gekocht. De freebase lijkt op hoe ik het op internet in beschrijvingen en op foto's ben tegengekomen; een geel-beige kleur.  De hcl is echter lichtgrijs. Is dit een normale kleur voor deze variant?   ,2000,31,https://drugsforum.nl/threads/5-meo-dmt-hcl-kleur.73077/,Denaamvanmijnkat,156753,https://drugsforum.nl/members/denaamvanmijnkat.156753/,2022-10-09
73038,drugsforum,Hoe een RC vendor te beoordelen?," Allereerst, om binnen de regels te blijven, ik ben niet op zoek naar namen van rc vendors!  Ik wil een bestelling plaatsen van een aantal rc’s. Eerder had ik al ergens 1p-lsd besteld (begin dit jaar ). Nu leek het mij logisch om daar meer te bestellen, maar ineens zie ik dat je nog enkel met bankoverschrijving kunt betalen. Beetje vreemd, maar na even zoeken lees ik recente slechte reviews. No-go dus!  Verder heb ik echt nul ervaring hiermee! Nu ben ik benieuwd op welke wijze jullie een rc vendor zoeken, beoordelen en kiezen, zodat ik zelf de juiste zoektocht kan volbrengen.   ",491,5,https://drugsforum.nl/threads/hoe-een-rc-vendor-te-beoordelen.73038/,JohnGalt,156629,https://drugsforum.nl/members/johngalt.156629/,2022-10-01
73036,drugsforum,Beste RC voor euforie en energie/zin op het werk," Hallo allemaal,  Ik word al jaren overmand door futloosheid, geen energie om m'n werk af te maken. Ik slik al antidepressiva en methylfenidaat, maar het is gewoon niet genoeg om deze 2m/130 kg beer productief te krijgen.  Ik zou dan ook een RC die me een lekker euforisch gevoel geeft (voor de positieve kijk op de wereld) en me een flinke sloot concentratie en energie geeft om ook wat te doen.  Ik wil het gebruiken tijdens m'n werkdagen, dus kan er niet dopie uit zien of zo. Misschien iets lichts aan de oppervlakte... geen idee. Ik ben een newbie in de wereld van RCs.  Bedankt.   ",2000,21,https://drugsforum.nl/threads/beste-rc-voor-euforie-en-energie-zin-op-het-werk.73036/,underscores,149891,https://drugsforum.nl/members/underscores.149891/,2022-10-01
73034,drugsforum,6-APB COMBO 2-FMA ??, 6-apb en 2 fma  Hallo daar Ik wil 6-apb en 2 fma samenvoegen. Ik heb 130 mg 6 apb geprobeerd en dat was niet genoeg. Ik weet dat de risico's toenemen als ik ze combineer. hoe moet ik dit doen? Ik denk erover om de 6-apb 130 mg weer te doen. en 2 fma 20 mg. heeft iemand het eerder gedaan?   ,599,19,https://drugsforum.nl/threads/6-apb-combo-2-fma.73034/,hiimacid,155476,https://drugsforum.nl/members/hiimacid.155476/,2022-09-30
73026,drugsforum,Bijpakken 4mmc," Over de dosering van 4mmc is genoeg te vinden (e.g. https://psychonautwiki.org/wiki/Mephedrone), maar hoe zit het nu precies met bijpakken?  Voor mdma wordt gezegd max 1x bijpakken met de helft van de 1e dosis. Bij vaker bijpakken krijg je overwegend alleen maar negatieve effecten. In mijn persoonlijke ervaring met mdma is dat meer dan 1x bijpakken bij mij vaak niet goed valt. Ik ga dan overgeven en wordt misselijk enzo en dan is mijn avond voorbij.  Wat ik bij 4mmc interessant vind is dat men vaak zegt dat ze langer door kunnen gaan. Dat is bijvoorbeeld handig op een festival ofzo. Maar hoeveel nemen ze dan steeds bij? Stel dat ik begin met een gemiddelde dosis van 150mg (oraal), hoe snel neem ik dan weer bij, hoeveel neem ik dan bij en hoe vaak kan ik dan bijpakken?   ",638,2,https://drugsforum.nl/threads/bijpakken-4mmc.73026/,Dragon1984,152801,https://drugsforum.nl/members/dragon1984.152801/,2022-09-29
73021,drugsforum,RC’s ‘dood’?," Enkele jaren geleden leken RC’s een bijna oneindige potentie te hebben. Een molecuul aanpassen en je had weer iets nieuws. Als er eentje verboden werd, kwam er weer eentje op. Maar al heel erg lang lijken de ‘opvolgers’ steeds slappere en slappere aftreksels te worden.   Hebben RC’s nog toekomst denken jullie?   ",2000,25,https://drugsforum.nl/threads/rc%E2%80%99s-%E2%80%98dood%E2%80%99.73021/,KoLijntje,16748,https://drugsforum.nl/members/kolijntje.16748/,2022-09-29
73020,drugsforum,dipentylone, iemand die deze stof kent of wel eens onderzocht heeft?   ,457,1,https://drugsforum.nl/threads/dipentylone.73020/,Morethenafeeling🔒,151587,https://drugsforum.nl/members/morethenafeeling%F0%9F%94%92.151587/,2022-09-28
73017,drugsforum,Legaliteit 2F-DCK in België," Hoi,  Ik zou graag eens 2F-DCK bestellen maar de legaliteit hiervan in België is mij niet zo duidelijk. Hier vind ik op p.22 dat er volgens de meest recente wetgeving een blanket ban is voor alle nieuwe amfetamines, cathinonen, synthetische cannabinoïden, piperazinestructuren en fentanylderivaten, categorieën waaronder 2F-DCK dus niet valt. Op het 'drugwiel' staat DCK tussen de legale stoffen, 2F-DCK wordt dan wel weer niet vermeld.  Ik ga er vanuit dat 2F-DCK dan ook legaal zal zijn, maar gezien het nergens zwart-wit wordt vermeld heb ik toch wat twijfels rond het bestellen ervan.   Iemand die hier meer over weet en de (il)legaliteit hiervan éénduidig kan bevestigen?  En nog een bijkomstig vraagje: hoe riskant is het om een dergelijk pakje de grens Nederland-België over te laten gaan?   ",354,1,https://drugsforum.nl/threads/legaliteit-2f-dck-in-belgi%C3%AB.73017/,lukyluk17,156681,https://drugsforum.nl/members/lukyluk17.156681/,2022-09-28
73011,drugsforum,RC Serotonine slurpers rangschikken," Ik moet deze stofjes nog proberen. (NEP wel 1 keer gedaan)  Wat zouden hiervan de ergste serotonine slurpers zijn?   3-MMC 6-APB NEP 4F-MPH 4-FMA  Ik gok 6-APB, 3-MMC en 4-FMA van wat ik zo lees. NEP en 4F-MPH toch wat minder denk ik. Wat is jullie mening/ervaring hierover? Of is het bij al deze stoffen aan te raden om 3 maanden pauze te houden? Hangt ook van de dosis af lijkt mij. Toen ik 16mg NEP probeerde zal dat niet mijn hele serotonine voorraad erdoorheen gejaagd hebben mag ik hopen. Want zo euforisch was het nou ook weer niet.   ",798,4,https://drugsforum.nl/threads/rc-serotonine-slurpers-rangschikken.73011/,TheRealKoekert,155945,https://drugsforum.nl/members/therealkoekert.155945/,2022-09-27
72993,drugsforum,2CB met andere stof erin," Goedenavond allen, een tijdje geleden heb ik een aantal 2CB pillen gekocht (roze raketje met een nasa logo erop). Ik heb deze laten testen en kreeg bevestiging dat hier inderdaad 12 mg 2CB in zat. Echter werd me verteld door de medewerker van de testlijn dat er ook een anderen psychoactieve stof in zat, maar dat ze niet wisten welke stof dit was. Mijn vraag is 1 herkent iemand de beschrijving van deze pil/heeft iemand er ervaring mee? En 2 heeft iemand een idee wat voor andere psychoactieve stof er naast 2CB in zou kunnen zitten? Ik ken verhalen van sterk gedoseerde pillen en XTC pillen met MDA, maar van 2CB pillen met nog een stof erin heb ik eigenlijk nog nooit gehoord. Iemand een idee? Ik twijfel nog een beetje om ze te gebruiken namelijk.   ",2000,35,https://drugsforum.nl/threads/2cb-met-andere-stof-erin.72993/,kasplantje,146150,https://drugsforum.nl/members/kasplantje.146150/,2022-09-24
72991,drugsforum,5-mapb na 4fma, Ik ben volgende week van plan te gaan beginnen met 4-fma. Ik pak dan 150mg op een feest.Voor de after lijkt het me nice om daarna nog een beetje in een lekkere space te gaan zitten. Zou ik dan de 5-mapb in de comedown kunnen pakken en hoeveel mg raden jullie aan? Ik hoef niet heel hard weer te gaan. Ik ben 1.80 en weeg ong 80kg   ,814,4,https://drugsforum.nl/threads/5-mapb-na-4fma.72991/,Druggers,155136,https://drugsforum.nl/members/druggers.155136/,2022-09-24
72989,drugsforum,2-FA & 6-APB mixen?, Goeden regenachtige middag iedereen. Heeft iemand ervaring of advies over een mix van 2-FA   &  6-APB Benzo Fury    ,688,11,https://drugsforum.nl/threads/2-fa-6-apb-mixen.72989/,Henk Smit,155276,https://drugsforum.nl/members/henk-smit.155276/,2022-09-24
72982,drugsforum,4-FMA tijd nodig heeft voor het werkt.," Goeie avond allen op dit forum.  Ik schrijf dit terwijl ik lichtelijk tussen redelijk aan onder invloed ben van 4-FMA.  Ik heb vandaag 2 capsules van dit spul genomen in capsules van 100mg, de eerste capsule was iets minder die bedroeg 80mg.  het tijd stip dat ik ze heb ingenomen was rond 7 uur en de 2e om tussen 8 en half 9.  het heeft heel lang geduurd voordat het op kwam, dus voor de gene die het ooit ook eens willen proberen hou er rekening mee dat dit zeker een poosje kan duren voor je er wat van merkt. Nu merk ik er redelijk wat van en ben er niet echt ontevreden mee maar ook niet super enthousiast over dit middel. Voornamelijk de klamme zweet handjes die je er van krijgt en de manier hoe ik dit bericht aan het schrijven ben.  voor de rest is het redelijk mellow achtig, beetje wazig alsof je een klein beetje mdma op hebt. Nu ben ik er voor nu wel klaar mee mede doordat het zo lang geduurd heb en ik er niet echt meer op zat te wachten het nog zou werken het me aardig uit de stemming hebt gehaald, maar nu ik dit weet ga ik zeker nog is proberen en er anders tegen aan te kijken.  Voor nu ga ik er lekker in, eten lukt trouwens ook gewoon dus ben benieuwd hoe slapen gaat worden. Maar heb er vertrouwen in.  Het was misschien een rommelige post, tis niet de meest helderste creatie van me. Maar het ging me toch ff om het waarschuwen dat 4-FMA vrij lang kan duren voor je het begint te merken, dus mocht je dit willen gebruiken hou er rekening mee dat het op zich laat wachten, zodat je niet als mij op het moment het werkt er eigenlijk al klaar mee bent en de werking niet optimaal kan ervaren.   ",885,3,https://drugsforum.nl/threads/4-fma-tijd-nodig-heeft-voor-het-werkt.72982/,Ketaboer23,154232,https://drugsforum.nl/members/ketaboer23.154232/,2022-09-24
72972,drugsforum,"Onderschatte gevaren van RC cannabinoids, weinig onderzoek, weinig kennis"," Ik lees echt de meest akelige verhalen op het internet, reddit bluelight erowid etc over synthetische cannabinoiden. Ik heb er geen ervaring mee maar het schijnt echt een van de gevaarlijkste RC groep te zijn om uit te proberen met het risico op overdosering, verkeerde synthese, verkeerde reactie van het lichaam, een gast die met het ziekenhuis afgevoerd moest worden en het had over zijn gedachtes die constant in tweeen splitsten waardoor hij het gevoel had gek te worden en psychotisch. Maar hij kon niet meer goed bewegen om de buitenwereld duidelijk te maken wat er gaande was en gleed steeds meer in een delier achtige toestand, zo verklaarde hij.      			So I was smoking with a friend I was visiting; hardly ever smoked, so my tolerance was zero, and I was on the moon after a bowl. Then they got out some other stuff, called it ""purp"", and said it was just synthetic marijuana. I'd never heard of it, thought, ""Oh, they just sprinkled THC on some inert matter."" They put a small bit of it on top of a normal bowl, and I took one hit.  In a few minutes, I could feel it moving through my body, taking control. First, I couldn't move my legs, then my arms. I was fighting it in my mind, which physically meant I was shaking violently. Soon, I couldn't move, and slouched over in my seat. Then it took over my mind. I have a hard time describing it, but basically, any time I would think something, the exact opposite thought would be thought simultaneously. The two were indistinguishable, though, so nohing but simultaneous contradictions went through my head. This wasn't just some internal conflict, though; EVERY little bitty thought was duplicated and mirrored. There was no rational thought, no way to even hink about what was going on, just sheer terror. I didn't know I could be that afraid. I'd known ""fear of the dark"", and ""fear of a shock scare"", but ""fear of being eternally trapped in your own broken mind"" is just...  My friend, having seen me have a seizure and then fall over, called my parents, who called an ambulance. My dad showed up. I think that was the most horrible thing I've ever seen. He was picking me up out of the seat, crying, begging me to move. I couldn't, I couldn't even blink, I wasn't even sure I was alive, but I could still see him when my eyes rolled open. An ambulance showed up, and they took me away. I thought it was odd that the ambulance drivers never once looked me in the eyes. The newer of the two practiced putting in an IV, and a nurse later said something about it being the biggest size. I could still feel that. I was terrified that this was what death was.  Got to he hospital, friend lied and said I just got overheated, so they start throwing ice on me. I turn blue. Eventually, I start regaining some conrol. After a few hours, I can think right. Another few hours, and I can move my head enough to kinda communicate. Still couldn't even urinate on my own; had to get a catheter. They establish that it was synthetic marijuana, and basically say they just have to wait it out.  After almost an entire day, I can walk and function normally. The nurses said they've had a lot of this lately. Some people turn out fine like me, while others leave with brain damage or just die"". 		 Klik om te vergroten...  En zo nog vele anderen, sommige nog ernstiger dan de anderen. En natuurlijk ook onweerlegbaar de kleine groep positieve effecten en resultaten. Maar bij iets dat overduidelijk zo gevaarlijk is en zo potent en niet uitvoering en met weinig wetenschappelijke onderbouwde feiten is te verklaren. Er is nog heel veel onbekend. Cannabis speelt in op unieke veelal minder begrepen receptoren dan andere drugs. Maar het voordeel van reguliere wiet is dat je ondanks dat geen overdosis kunt krijgen. Met synthetische cannabinoids is dat dus etreem snel, extreem onvoorspelbaar en fysiek en mentaal ronduit gevaarlijk, verslavend en verwoestend.  Ik ben hier zo van geschrokken omdat ik toch wel een best klunzige gebruiker ben die het niet altijd super nauw neemt met nieuwe middelen, ik lees me wel in en ik probeer me goed voor te bereiden maar ik heb serieus overwogen om die Cannabinoid Synths te proberen en ooit een keer een miniscule hoeveelheid van de minst beruchte soort over een joint te sprinkelen (ooit, nog steeds cannabis-vrij) maar ik stap hier volledig van weg. Er zijn sommige beter en veiliger dan andere, de jwh-018 hoor ik goede dingen over. Maar er zijn ook sommige waarvan de naam gewoon één of andere duivelse kreet is. Alleen al deze:  5F-PB-22 1-pentyfluoro-1H-indole-3-carboxylic acid 8-quinolinyl ester Dat klinkt toch niet goed?  Misschien hebben mensen meer ervaring en kunnen ze bevestigen, of ervaringen delen. Ik was zo geschrokken en ben gelijk heel geintresseerd en vind dat er meer aandacht naar zou moeten komen. Of ik ben gewoon de laatste die hierachter komt, dat kan ook.  Thoughts?  Op reddit vroeg iemand hoe gebruik je jwh-018? Antwoord: je pakt het met beide handen en gooit het in de afvalbak.   ",782,4,https://drugsforum.nl/threads/onderschatte-gevaren-van-rc-cannabinoids-weinig-onderzoek-weinig-kennis.72972/,Dirkjan,145204,https://drugsforum.nl/members/dirkjan.145204/,2022-09-22
72971,drugsforum,Legale benzo tripkiller?, Om achter de hand te houden. Welke raden jullie me aan?   ,344,4,https://drugsforum.nl/threads/legale-benzo-tripkiller.72971/,Casrus,154535,https://drugsforum.nl/members/casrus.154535/,2022-09-22
72961,drugsforum,Over mijn (volgensmij) sterke-drank-RC benzo binge ontwenning (anderhalve week binge)," Hallo,  Ik wou het toch nog eens hebben over mijn absoluut angst aanjagende ontwenning van de anderhalve week lang elke dag veel bromazolam en Pyrazolam combo met in de avond een fles vodka (begon benzo's vanaf ochtend en het drinken dan vanaf 18:00 of 19:00 tot in bed rond 23:00, fles leeg.)  Weet dat gevaarlijk is maar heb nu mijn lesje echt geleerd (wanneer het kan zo snel mogelijk weer met Antabus beginnen. Ik ben mij helemaal dood geschrokken, ontwenning is het meest tijdens het slapen met zware slaap verlammingen met ENGE hallucinaties, nachtmerries waar niet uit te ontsnappen zijn, dit gaat nog iets vaker gebeuren ben ik bang.  Kan het zijn dat de 1p-lsd trip met bromazolam van (perongelijk dubel zegels genomen) 450mcg toch wel beetje after-effects kan hebben gegeven die zich aansluiten bij deze ontwenning?  Tijdens de slaap verlammingen door acute stop met drank en benzo binge heb ik mensen in mijn kamer zien rond lopen, praten schelden kijken enzovoort, met verminkte gezichten! Één van de engste was dat er ineens een vrouw met een HEEL kwaad en wat verminkt gezicht, UIT de muur liep, langzaam en hurkend en SCHREEUWEND met een scheef hoofd dichter en dichter met haar gezicht naar het mijne was aan het komen, dat stopte toen ik mijn ogen dicht kneep en probeerde voor hulp te schreeuwen, kwam geen stem uit.. Dit is de engste hallucinatie die ik heb mee gemaakt (heb er niet heel veel mee gemaakt, nooit met zoveel detail, dat het zo echt leek. Het schreeuwen was ook echt HARD. Ik ken wel een fragment uit 'Twin Peaks' met een vrouw die ongeveer zo'n schreeuw liet horen als wat ik hoorde, Twin Peaks is ook een super rare serie, maar ik wou het toch eens laten horen als iemand dat wil  het stukje geschreeuw komt in 0:45 in filmpje Twin Peaks The Black Lodge ""Meanwhile"" Scene  Ben niet goed in dit soort ervaringen uit leggen maar hoop dat iemand ooit zoiets heeft mee gemaakt en het misschien wilt delen met mij, vind het erg interessant. Filmpje vind je misschien wat kinderachtig maar het is wel ook nog beetje trippy. Ik had trouwens 50mg oxazepam op omdat ik niet kon slapen (alleen voor noodgevallen zoals dit mag dat, alleen hielt het niet genoeg helaas.)   ",398,1,https://drugsforum.nl/threads/over-mijn-volgensmij-sterke-drank-rc-benzo-binge-ontwenning-anderhalve-week-binge.72961/,Practuna,134518,https://drugsforum.nl/members/practuna.134518/,2022-09-20
72957,drugsforum,4-MMC (Mephedrone) is het anno 2022 nog waard?," Ik heb jullie eerlijke mening nodig. Recentelijk ben ik 4-MMC tegen gekomen via het dark web. Dit heeft er voor gezorgd dat ik weer eens lichte interesse heb in dit stofje.  Ik heb wat rond zitten neuzen en weet het vgende van 4-MMC. Het schijnt een soort combinatie te zijn van speed en MDMA. Hierbij heb je een euforische high. Het was voornamelijk in het begin van de Research Chemical Scene erg populair en werd ook verkocht als zogenaamd ‘bath salt.’  Daarnaast zit bij deze drug altijd een soort hype achter de naam heb ik het idee. Als je op Reddit vraagt of dit nou echt zoveel beter is dan bijvoorbeeld MDMA dan krijg je al snel veel mensen die dit beamen. Echter is dit vaak zonder argumenten waarom, het is gewoon zo.  Ik vraag mij dus daadwerkelijk of dit de moeite waard is. Komt dit door de hype en lichte nostalgie van onze internet vrienden dat deze drug een soort ‘cultstatus’ bereikt heeft? Men heeft het veelal over ‘pre-ban’ 4-MMC, wat geweldig schijnt te zijn.  Of heb ik echt de boot gemist en moet ik dit proberen als ik al een hoop andere dingen geprobeerd heb. Ik heb een voorliefde voor MDMA en spaar graag mijn serotonines op om om de zoveel tijd goed te kunnen trippen. 3-MMC is bijvoorbeeld ook favoriet bij velen maar dit vind ik totaal niet in verhouding staan met sommige reports over hoe geweldig dit spul is.  Daarnaast denk ik dat veel mensen dus nostalgisch zijn en denken aan 4-MMC als geweldig. Mede omdat er niks anders was en het een ‘veilig’ (niet helemaal maar toendertijd waren er veel vuile MDMA pillen) alternatief was. Dit is ook de reden dat ik mij afvraag of ik het wil proberen. Ik heb namelijk een full time baan en ben opeens verantwoordelijk geworden. De dagen doorhalen en ff al je serotonines erdoorheen blazen zijn voorbij. Ik kan natuurlijk wel een dagje vrij nemen, dat is geen probleem maar wil eigenlijk na dinsdag geen last meer ervaren. Dit is natuurlijk ook afhankelijk van gedoseerd en verantwoord gebruik.  Dus, beste forum leden. Voor degene die het gebruikt hebben. Vraag ik je loeiharde en ongefilterde mening over 4-MMC. Hoe controversieel die ook is, ik hoor graag van jullie.  Thanks.   ",4000,35,https://drugsforum.nl/threads/4-mmc-mephedrone-is-het-anno-2022-nog-waard.72957/,witte270,146519,https://drugsforum.nl/members/witte270.146519/,2022-09-19
72943,drugsforum,Bromazolam Blackouts, Wat is het meeste aantal MG Bromazolam wat je op 1 dag hebt ingenomen? De meest erge benzo blackout die je ooit hebt gehad? Reacties over andere RC Benzo's zijn ook welkom.   ,803,4,https://drugsforum.nl/threads/bromazolam-blackouts.72943/,Henk Smit,155276,https://drugsforum.nl/members/henk-smit.155276/,2022-09-17
72933,drugsforum,Nexus flip XTC + 2CC," Hooooii!  Volgende week weer een feestje op de planning staan, van plan om voor de eerste keer nexus te flippen, maar met 2CC i.p.v. 2CB.  Planning is om te starten met Mdma en dan op de comedown 2CC te pakken. Vroeg mij af of iemand hier ervaring mee heeft? En op welke dosis de 2CC te pakken of zeggen jullie niet de moeite waard met 2CC.  Ben benieuwd!   ",2000,18,https://drugsforum.nl/threads/nexus-flip-xtc-2cc.72933/,HobbymatigGebruik99,152653,https://drugsforum.nl/members/hobbymatiggebruik99.152653/,2022-09-16
72928,drugsforum,3mmc leidt tot astmatische klachten?," Goedendag, na een paar jaar op dit forum te kijken toch besloten een account aan te maken. Dit omdat ik al meerdere keren iets heb willen plaatsen, en ik met veel vragen zit.  Ik ben een jongen van 19, ik zal eerst kort vertellen over mijn drugsgebruik. Ik gebruik alcohol elke week, wiet of hasj elke week en de andere middelen gemiddeld 1x in 2 maanden. Zo heb ik o.a. 3mmc, xtc, truffels en mdma geprobeerd.  De eerste keer dat ik zonder combinatie 3mmc gebruikte heb ik 2 sleutelpuntjes gebruikt (niet veel dus). Dit deed ik puur voor wat meer energie. Aan het eind van de avond toen het uitwerkte was ik best wel kortademig voor ongeveer 2 a 3 uur. Van de zomer gebruikte ik voor het eerst veel 3mmc op een festival. Het was fantastisch, ik denk dat ik zo een 0.5 - 1 gram heb genomen. Toen ik savonds terug ging naar de tent om te gaan slapen op de camping, werd ik weer benauwd. Ik probeerde te slapen maar had erg moeite met mijn ademhaling (soort hyperventilatie), uiteindelijk viel ik in slaap. Sinds die dag begon ik te hoesten, het werd steeds iets erger. Wel belangrijk om erbij te vertellen, de 1.5 week voor het festival had ik al last van kriebelhoest. De hoest die ik na het festival had was slijmhoest. Als ik diep uitademde hoorde je een borrelend geluid, bij het sporten leek dit geluid zelfs tot mijn buik door te gaan. Door het hoesten werd dat gevoel uiteraard minder. Met het borrelende bedoel ik geen slijm dat normaal vanuit je keel borreld, het kwam van dieper leek het wel. Na een maand hoesten is het nu een stuk minder, toch is het er nogsteeds zo nu en dan. Bij de huisarts geweest die mij vertelde dat ze aan mijn longen hoorde dat er inderdaad iets astmatisch aanwezig is. Nou heb ik toen ik jong was puffjes gehad, maar heb ik nooit astma gehad.  Nu vraag ik mij af of dit hoesten door de 3mmc is gekomen, en of de 3mmc mijn astmatische klachten heeft kunnen oproepen? Of dit ook het geval zal zijn bij speed, of coke? Of er mensen zijn die ook soortgelijke ervaringen hebben? En of het mij nu word afgeraden te gebruiken?  Ik ben heel benieuwd naar jullie reacties. Mvg,   ps: ik heb dit alleen bij 3mmc gehad, nooit bij xtc bijvoorbeeld   ",941,13,https://drugsforum.nl/threads/3mmc-leidt-tot-astmatische-klachten.72928/,Psychojohn,156584,https://drugsforum.nl/members/psychojohn.156584/,2022-09-16
